author,text,location,interjection,sentence_position,sentence
Euripides,Iphigenia in Tauris,422,εἴθʼ,1,"εἴθʼ εὐχαῖσιν δεσποσύνοις Λήδας Ἑλένα φίλα παῖς ἐλθοῦσα τύχοι τὰν Τρῳάδα λιποῦσα πόλιν, ἵνʼ ἀμφὶ χαίτᾳ δρόσον αἱματηρὰν ἑλιχθεῖσα λαιμοτόμῳ δεσποίνας χειρὶ θάνοι ποινὰς δοῦσʼ ἀντιπάλους."
Euripides,Iphigenia in Tauris,459,ὦ,1,"ὦ πότνιʼ, εἴ σοι τάδʼ ἀρεσκόντως πόλις ἥδε τελεῖ, δέξαι θυσίας, ἃς ὁ παρʼ ἡμῖν νόμος οὐχ ὁσίας ἀναφαίνει."
Euripides,Iphigenia in Tauris,861,φεῦ,1,φεῦ·
Euripides,Iphigenia in Tauris,479,ὦ,4,"πόθεν ποθʼ ἥκετʼ, ὦ ταλαίπωροι ξένοι;"
Euripides,Iphigenia in Tauris,482,ὦ,13,"τί ταῦτʼ ὀδύρῃ, κἀπὶ τοῖς μέλλουσι νῷν κακοῖσι λυπεῖς, ἥτις εἶ ποτʼ, ὦ γύναι;"
Euripides,Iphigenia in Tauris,509,ὦ,4,"πρὸς θεῶν, ἀληθῶς, ὦ ξένʼ, εἶ κεῖθεν γεγώς;"
Euripides,Iphigenia in Tauris,525,ὦ,1,"ὦ μῖσος εἰς Ἕλληνας, οὐκ ἐμοὶ μόνῃ."
Euripides,Iphigenia in Tauris,533,ὦ,1,"ὦ πότνιʼ, ὡς εὖ."
Euripides,Iphigenia in Tauris,553,ὦ,1,ὦ πανδάκρυτος ἡ κτανοῦσα χὡ κτανών.
Euripides,Iphigenia in Tauris,557,ὦ,1,ὦ συνταραχθεὶς οἶκος.
Euripides,Iphigenia in Tauris,861,φεῦ,1,φεῦ·
Euripides,Iphigenia in Tauris,860,φεῦ,1,φεῦ φεῦ·
Euripides,Iphigenia in Tauris,860,φεῦ,2,φεῦ φεῦ·
Euripides,Iphigenia in Tauris,578,ὦ,10,"ἐς γὰρ δή τινʼ ἥκομεν λόγον, ὑμῖν τʼ ὄνησιν, ὦ ξένοι, σπουδῆς ἅμα κἀμοί."
Euripides,Iphigenia in Tauris,597,ὦ,6,"καλῶς ἔλεξας τἄλλα πλὴν ἕν, ὦ ξένη·"
Euripides,Iphigenia in Tauris,609,ὦ,1,"ὦ λῆμʼ ἄριστον, ὡς ἀπʼ εὐγενοῦς τινος ῥίζης πέφυκας τοῖς φίλοις τʼ ὀρθῶς φίλος."
Euripides,Iphigenia in Tauris,619,ὦ,3,"ἄζηλά γʼ, ὦ νεᾶνι, κοὐκ εὐδαίμονα."
Euripides,Iphigenia in Tauris,861,φεῦ,1,φεῦ·
Euripides,Iphigenia in Tauris,628,ὦ,3,"μάταιον εὐχήν, ὦ τάλας, ὅστις ποτʼ εἶ, ηὔξω·"
Euripides,Iphigenia in Tauris,646,ὦ,7,"οἶκτος γὰρ οὐ ταῦτʼ, ἀλλὰ χαίρετʼ, ὦ ξέναι."
Euripides,Iphigenia in Tauris,646,ὦ,5,"σὲ δὲ τύχας μάκαρος, ὦ νεανία, σεβόμεθʼ, ἐς πάτραν ὅτι ποτʼ ἐπεμβάσῃ."
Euripides,Iphigenia in Tauris,651,ὦ,1,ὦ σχέτλιοι πομπαί.
Euripides,Iphigenia in Tauris,860,φεῦ,1,"φεῦ φεῦ, διόλλυσαι."
Euripides,Iphigenia in Tauris,860,φεῦ,2,"φεῦ φεῦ, διόλλυσαι."
Euripides,Iphigenia in Tauris,651,αἰαῖ,1,αἰαῖ αἰαῖ.
Euripides,Iphigenia in Tauris,651,αἰαῖ,2,αἰαῖ αἰαῖ.
Euripides,Iphigenia in Tauris,708,ὦ,7,"ἐμῶν γὰρ φίλτατόν σʼ ηὗρον φίλων, ὦ συγκυναγὲ καὶ συνεκτραφεὶς ἐμοί, ὦ πόλλʼ ἐνεγκὼν τῶν ἐμῶν ἄχθη κακῶν."
Euripides,Iphigenia in Tauris,708,ὦ,12,"ἐμῶν γὰρ φίλτατόν σʼ ηὗρον φίλων, ὦ συγκυναγὲ καὶ συνεκτραφεὶς ἐμοί, ὦ πόλλʼ ἐνεγκὼν τῶν ἐμῶν ἄχθη κακῶν."
Euripides,Iphigenia in Tauris,716,ὦ,10,"ἔσται τάφος σοι, καὶ κασιγνήτης λέχος οὐκ ἂν προδοίην, ὦ τάλας, ἐπεί σʼ ἐγὼ θανόντα μᾶλλον ἢ βλέπονθʼ ἕξω φίλον."
Euripides,Iphigenia in Tauris,774,ὦ,5,"Κόμισαί μʼ ἐς Ἄργος, ὦ σύναιμε, πρὶν θανεῖν, ἐκ βαρβάρου γῆς καὶ μετάστησον θεᾶς σφαγίων, ἐφʼ οἷσι ξενοφόνους τιμὰς ἔχω."
Euripides,Iphigenia in Tauris,780,ὦ,1,ὦ θεοί.
Euripides,Iphigenia in Tauris,788,ὦ,1,"ὦ ῥᾳδίοις ὅρκοισι περιβαλοῦσά με, κάλλιστα δʼ ὀμόσασʼ, οὐ πολὺν σχήσω χρόνον, τὸν δʼ ὅρκον ὃν κατώμοσʼ ἐμπεδώσομεν."
Euripides,Iphigenia in Tauris,795,ὦ,1,"ὦ φιλτάτη μοι σύγγονʼ, ἐκπεπληγμένος ὅμως σʼ ἀπίστῳ περιβαλὼν βραχίονι ἐς τέρψιν εἶμι, πυθόμενος θαυμάστʼ ἐμοί."
Euripides,Iphigenia in Tauris,800,ὦ,1,"ὦ συγκασιγνήτη τε κἀκ ταὐτοῦ πατρὸς Ἀγαμέμνονος γεγῶσα, μή μʼ ἀποστρέφου, ἔχουσʼ ἀδελφόν, οὐ δοκοῦσʼ ἕξειν ποτέ."
Euripides,Iphigenia in Tauris,805,ὦ,5,"οὐκ ἔστʼ ἐκεῖ σός, ὦ τάλαινα, σύγγονος."
Euripides,Iphigenia in Tauris,815,ὦ,1,"ὦ φίλτατʼ, ἐγγὺς τῶν ἐμῶν κάμπτεις φρενῶν."
Euripides,Iphigenia in Tauris,827,ὦ,1,"ὦ φίλτατʼ, οὐδὲν ἄλλο, φίλτατος γὰρ εἶ, ἔχω σʼ, Ὀρέστα, τηλύγετον ἀπὸ πατρίδος Ἀργόθεν, ὦ φίλος."
Euripides,Iphigenia in Tauris,827,ὦ,15,"ὦ φίλτατʼ, οὐδὲν ἄλλο, φίλτατος γὰρ εἶ, ἔχω σʼ, Ὀρέστα, τηλύγετον ἀπὸ πατρίδος Ἀργόθεν, ὦ φίλος."
Euripides,Iphigenia in Tauris,837,ὦ,1,"ὦ κρεῖσσον ἢ λόγοισιν εὐτυχοῦσά μου ψυχά, τί φῶ;"
Euripides,Iphigenia in Tauris,842,ὦ,4,"ἄτοπον ἁδονὰν ἔλαβον, ὦ φίλαι·"
Euripides,Iphigenia in Tauris,845,ἰὼ,1,ἰὼ Κυκλωπὶς ἑστία·
Euripides,Iphigenia in Tauris,845,ἰὼ,1,"ἰὼ πατρίς, Μυκήνα φίλα, χάριν ἔχω ζόας, χάριν ἔχω τροφᾶς, ὅτι μοι συνομαίμονα τόνδε δόμοις ἐξεθρέψω φάος."
Euripides,Iphigenia in Tauris,850,ὦ,7,"γένει μὲν εὐτυχοῦμεν, ἐς δὲ συμφοράς, ὦ σύγγονʼ, ἡμῶν δυστυχὴς ἔφυ βίος."
Euripides,Iphigenia in Tauris,post 101B,οἴμοι,1,οἴμοι.
Euripides,Iphigenia in Tauris,856,ὦ,2,"ἀνυμέναιος, ὦ σύγγονʼ, Ἀχιλλέως ἐς κλισίαν λέκτρων δολίαν ὅτʼ ἀγόμαν·"
Euripides,Iphigenia in Tauris,861,φεῦ,1,φεῦ φεῦ χερνίβων τῶν ἐκεῖ.
Euripides,Iphigenia in Tauris,861,φεῦ,2,φεῦ φεῦ χερνίβων τῶν ἐκεῖ.
Euripides,Iphigenia in Tauris,866,ὦ,5,"εἰ σόν γʼ ἀδελφόν, ὦ τάλαινʼ, ἀπώλεσας."
Euripides,Iphigenia in Tauris,869,ὦ,1,ὦ μελέα δεινᾶς τόλμας.
Euripides,Iphigenia in Tauris,869,ὤμοι,5,"δείνʼ ἔτλαν δείνʼ ἔτλαν, ὤμοι σύγγονε."
Euripides,Iphigenia in Tauris,881,ὦ,4,"τόδε τόδε σόν, ὦ μελέα ψυχά, χρέος ἀνευρίσκειν."
Euripides,Iphigenia in Tauris,922,ὦ,2,χαῖρʼ ὦ πόσις μοι τῆς ἐμῆς ὁμοσπόρου.
Euripides,Iphigenia in Tauris,970,αὖ,16,"ὅσαι δʼ Ἐρινύων οὐκ ἐπείσθησαν νόμῳ, δρόμοις ἀνιδρύτοισιν ἠλάστρουν μʼ ἀεί, ἕως ἐς ἁγνὸν ἦλθον αὖ Φοίβου πέδον, καὶ πρόσθεν ἀδύτων ἐκταθείς, νῆστις βορᾶς, ἐπώμοσʼ αὐτοῦ βίον ἀπορρήξειν θανών, εἰ μή με σώσει Φοῖβος, ὅς μʼ ἀπώλεσεν."
Euripides,Iphigenia in Tauris,983,ὦ,2,"ἀλλʼ, ὦ φιληθεῖσʼ, ὦ κασίγνητον κάρα, σῷσον πατρῷον οἶκον, ἔκσῳσον δʼ ἐμέ·"
Euripides,Iphigenia in Tauris,983,ὦ,4,"ἀλλʼ, ὦ φιληθεῖσʼ, ὦ κασίγνητον κάρα, σῷσον πατρῷον οἶκον, ἔκσῳσον δʼ ἐμέ·"
Euripides,Iphigenia in Tauris,post 101B,οἴμοι,1,"οἴμοι, διεφθάρμεσθα·"
Euripides,Iphigenia in Tauris,1056,ὦ,1,"ὦ φίλταται γυναῖκες, εἰς ὑμᾶς βλέπω, καὶ τἄμʼ ἐν ὑμῖν ἐστιν ἢ καλῶς ἔχειν ἢ μηδὲν εἶναι καὶ στερηθῆναι πάτρας φίλου τʼ ἀδελφοῦ φιλτάτης τε συγγόνου."
Euripides,Iphigenia in Tauris,1082,ὦ,1,"ὦ πότνιʼ, ἥπερ μʼ Αὐλίδος κατὰ πτυχὰς δεινῆς ἔσωσας ἐκ πατροκτόνου χερός, σῶσόν με καὶ νῦν τούσδε τʼ·"
Euripides,Iphigenia in Tauris,1106,ὦ,1,"ὦ πολλαὶ δακρύων λιβάδες, αἳ παρηίδας εἰς ἐμὰς ἔπεσον, ἁνίκα πύργων ὀλομένων ἐν ναυσὶν ἔβαν πολεμίων ἐρετμοῖσι καὶ λόγχαις."
Euripides,Iphigenia in Tauris,1157,ἔα,1,ἔα·
Euripides,Iphigenia in Tauris,1230,ὦ,1,"ὦ Διὸς Λητοῦς τʼ ἄνασσα παρθένʼ, ἢν νίψω φόνον τῶνδε καὶ θύσωμεν οὗ χρή, καθαρὸν οἰκήσεις δόμον, εὐτυχεῖς δʼ ἡμεῖς ἐσόμεθα."
Euripides,Iphigenia in Tauris,1250,ὦ,12,"ἔτι μιν ἔτι βρέφος, ἔτι φίλας ἐπὶ ματέρος ἀγκάλαισι θρῴσκων ἔκανες, ὦ Φοῖβε, μαντείων δʼ ἐπέβας ζαθέων, τρίποδί τʼ ἐν χρυσέῳ θάσσεις, ἐν ἀψευδεῖ θρόνῳ μαντείας βροτοῖς θεσφάτων νέμων ἀδύτων ὕπο, Κασταλίας ῥεέθρων γείτων, μέσον γᾶς ἔχων μέλαθρον."
Euripides,Iphigenia in Tauris,1284,ὦ,1,"ὦ ναοφύλακες βώμιοί τʼ ἐπιστάται, Θόας ἄναξ γῆς τῆσδε ποῦ κυρεῖ βεβώς;"
Euripides,Iphigenia in Tauris,1304,ὠή,1,"ὠή, χαλᾶτε κλῇθρα, τοῖς ἔνδον λέγω, καὶ δεσπότῃ σημήναθʼ οὕνεκʼ ἐν πύλαις πάρειμι, καινῶν φόρτον ἀγγέλλων κακῶν."
Euripides,Iphigenia in Tauris,1307,φεῦ,1,φεῦ·
Euripides,Iphigenia in Tauris,1321,ὦ,1,ὦ θαῦμα _ πῶς σε μεῖζον ὀνομάσας τύχω;
Euripides,Iphigenia in Tauris,1386,ὦ,1,"ὦ γῆς Ἑλλάδος ναῦται, νεὼς λάβεσθε κώπαις ῥόθιά τʼ ἐκλευκαίνετε·"
Euripides,Iphigenia in Tauris,1398,ὦ,1,ὦ Λητοῦς κόρη σῷσόν με τὴν σὴν ἱερέαν πρὸς Ἑλλάδα ἐκ βαρβάρου γῆς καὶ κλοπαῖς σύγγνωθʼ ἐμαῖς.
Euripides,Iphigenia in Tauris,1420,ὦ,1,"ὦ τλῆμον Ἰφιγένεια, συγγόνου μέτα θανῇ πάλιν μολοῦσα δεσποτῶν χέρας."
Euripides,Iphigenia in Tauris,1422,ὦ,1,"ὦ πάντες ἀστοὶ τῆσδε βαρβάρου χθονός, οὐκ εἶα πώλοις ἐμβαλόντες ἡνίας παράκτιοι δραμεῖσθε κἀκβολὰς νεὼς Ἑλληνίδος δέξεσθε, σὺν δὲ τῇ θεῷ σπεύδοντες ἄνδρας δυσσεβεῖς θηράσετε, οἳ δʼ ὠκυπομποὺς ἕλξετʼ ἐς πόντον πλάτας;"
Euripides,Iphigenia in Tauris,1422,εἶα,8,"ὦ πάντες ἀστοὶ τῆσδε βαρβάρου χθονός, οὐκ εἶα πώλοις ἐμβαλόντες ἡνίας παράκτιοι δραμεῖσθε κἀκβολὰς νεὼς Ἑλληνίδος δέξεσθε, σὺν δὲ τῇ θεῷ σπεύδοντες ἄνδρας δυσσεβεῖς θηράσετε, οἳ δʼ ὠκυπομποὺς ἕλξετʼ ἐς πόντον πλάτας;"
Euripides,Iphigenia in Tauris,1487,ὦ,2,"ἴτʼ, ὦ πνοαί, ναυσθλοῦσθε τὸν Ἀγαμέμνονος παῖδʼ εἰς Ἀθήνας·"
Euripides,Iphigenia in Tauris,1492,ὦ,2,"ἀλλʼ, ὦ σεμνὴ παρά τʼ ἀθανάτοις καὶ παρὰ θνητοῖς, Παλλὰς Ἀθάνα, δράσομεν οὕτως ὡς σὺ κελεύεις."
Euripides,Iphigenia in Tauris,1497,ὦ,1,"_ _ _ ὦ μέγα σεμνὴ Νίκη, τὸν ἐμὸν βίοτον κατέχοις καὶ μὴ λήγοις στεφανοῦσα."
Euripides,Bacchae,55,ὦ,2,"ἀλλʼ, ὦ λιποῦσαι Τμῶλον ἔρυμα Λυδίας, θίασος ἐμός, γυναῖκες, ἃς ἐκ βαρβάρων ἐκόμισα παρέδρους καὶ ξυνεμπόρους ἐμοί, αἴρεσθε τἀπιχώριʼ ἐν πόλει Φρυγῶν τύμπανα, Ῥέας τε μητρὸς ἐμά θʼ εὑρήματα, βασίλειά τʼ ἀμφὶ δώματʼ ἐλθοῦσαι τάδε κτυπεῖτε Πενθέως, ὡς ὁρᾷ Κάδμου πόλις."
Euripides,Bacchae,73,ὦ,1,"ὦ μάκαρ, ὅστις εὐδαίμων τελετὰς θεῶν εἰδὼς βιοτὰν ἁγιστεύει καὶ θιασεύεται ψυχὰν ἐν ὄρεσσι βακχεύων ὁσίοις καθαρμοῖσιν, τά τε ματρὸς μεγάλας ὄργια Κυβέλας θεμιτεύων, ἀνὰ θύρσον τε τινάσσων, κισσῷ τε στεφανωθεὶς Διόνυσον θεραπεύει."
Euripides,Bacchae,99,ὦ,1,"ὦ Σεμέλας τροφοὶ Θῆβαι, στεφανοῦσθε κισσῷ·"
Euripides,Bacchae,120,ὦ,1,"ὦ θαλάμευμα Κουρήτων ζάθεοί τε Κρήτας Διογενέτορες ἔναυλοι, ἔνθα τρικόρυθες ἄντροις βυρσότονον κύκλωμα τόδε μοι Κορύβαντες ηὗρον·"
Euripides,Bacchae,144,Ὦ,1,"Ὦ ἴτε βάκχαι, ἴτε βάκχαι, Τμώλου χρυσορόου χλιδᾷ μέλπετε τὸν Διόνυσον βαρυβρόμων ὑπὸ τυμπάνων, εὔια τὸν εὔιον ἀγαλλόμεναι θεὸν ἐν Φρυγίαισι βοαῖς ἐνοπαῖσί τε, λωτὸς ὅταν εὐκέλαδος ἱερὸς ἱερὰ παίγματα βρέμῃ, σύνοχα φοιτάσιν εἰς ὄρος εἰς ὄρος·"
Euripides,Bacchae,178,ὦ,1,"ὦ φίλταθʼ, ὡς σὴν γῆρυν ᾐσθόμην κλύων σοφὴν σοφοῦ παρʼ ἀνδρός, ἐν δόμοισιν ὤν·"
Euripides,Bacchae,255,αὖ,2,τόνδʼ αὖ θέλεις τὸν δαίμονʼ ἀνθρώποισιν ἐσφέρων νέον σκοπεῖν πτερωτοὺς κἀμπύρων μισθοὺς φέρειν.
Euripides,Bacchae,263,ὦ,1,"ὦ ξένʼ, οὐκ αἰδῇ θεοὺς Κάδμον τε τὸν σπείραντα γηγενῆ στάχυν, Ἐχίονος δʼ ὢν παῖς καταισχύνεις γένος;"
Euripides,Bacchae,274,ὦ,3,"δύο γάρ, ὦ νεανία, τὰ πρῶτʼ ἐν ἀνθρώποισι·"
Euripides,Bacchae,328,ὦ,1,"ὦ πρέσβυ, Φοῖβόν τʼ οὐ καταισχύνεις λόγοις, τιμῶν τε Βρόμιον σωφρονεῖς, μέγαν θεόν."
Euripides,Bacchae,330,ὦ,1,"ὦ παῖ, καλῶς σοι Τειρεσίας παρῄνεσεν."
Euripides,Bacchae,358,ὦ,1,"ὦ σχέτλιʼ, ὡς οὐκ οἶσθα ποῦ ποτʼ εἶ λόγων."
Euripides,Bacchae,441,Ὦ,1,"Ὦ ξένʼ, οὐχ ἑκὼν ἄγω σε, Πενθέως δʼ ὅς μʼ ἔπεμψʼ ἐπιστολαῖς."
Euripides,Bacchae,443,αὖ,3,"ἃς δʼ αὖ σὺ βάκχας εἷρξας, ἃς συνήρπασας κἄδησας ἐν δεσμοῖσι πανδήμου στέγης, φροῦδαί γʼ ἐκεῖναι λελυμέναι πρὸς ὀργάδας σκιρτῶσι Βρόμιον ἀνακαλούμεναι θεόν·"
Euripides,Bacchae,478,αὖ,2,τοῦτʼ αὖ παρωχέτευσας εὖ κοὐδὲν λέγων.
Euripides,Bacchae,528,ὦ,4,"ἀναφαίνω σε τόδʼ, ὦ Βάκχιε, Θήβαις ὀνομάζειν."
Euripides,Bacchae,530,ὦ,4,"σὺ δέ μʼ, ὦ μάκαιρα Δίρκα, στεφανηφόρους ἀπωθῇ θιάσους ἔχουσαν ἐν σοί."
Euripides,Bacchae,550,ὦ,3,"ἐσορᾷς τάδʼ, ὦ Διὸς παῖ Διόνυσε, σοὺς προφήτας ἐν ἁμίλλαισιν ἀνάγκας;"
Euripides,Bacchae,556,ὦ,8,"πόθι Νύσας ἄρα τᾶς θηροτρόφου θυρσοφορεῖς θιάσους, ὦ Διόνυσʼ, ἢ κορυφαῖς Κωρυκίαις;"
Euripides,Bacchae,560,ὦ,2,"μάκαρ ὦ Πιερία, σέβεταί σʼ Εὔιος, ἥξει τε χορεύσων ἅμα βακχεύμασι, τόν τʼ ὠκυρόαν διαβὰς Ἀξιὸν εἱλισσομένας Μαινάδας ἄξει, Λυδίαν πατέρα τε, τὸν τᾶς εὐδαιμονίας βροτοῖς ὀλβοδόταν, τὸν ἔκλυον εὔιππον χώραν ὕδασιν καλλίστοισι λιπαίνειν."
Euripides,Bacchae,565,ἰώ,1,"ἰώ, κλύετʼ ἐμᾶς κλύετʼ αὐδᾶς, ἰὼ βάκχαι, ἰὼ βάκχαι."
Euripides,Bacchae,565,ἰὼ,6,"ἰώ, κλύετʼ ἐμᾶς κλύετʼ αὐδᾶς, ἰὼ βάκχαι, ἰὼ βάκχαι."
Euripides,Bacchae,565,ἰὼ,8,"ἰώ, κλύετʼ ἐμᾶς κλύετʼ αὐδᾶς, ἰὼ βάκχαι, ἰὼ βάκχαι."
Euripides,Bacchae,580,ἰὼ,1,"ἰὼ ἰώ, πάλιν αὐδῶ, ὁ Σεμέλας, ὁ Διὸς παῖς."
Euripides,Bacchae,580,ἰώ,2,"ἰὼ ἰώ, πάλιν αὐδῶ, ὁ Σεμέλας, ὁ Διὸς παῖς."
Euripides,Bacchae,582,ἰὼ,1,"ἰὼ ἰὼ δέσποτα δέσποτα, μόλε νυν ἡμέτερον ἐς θίασον, ὦ Βρόμιε Βρόμιε."
Euripides,Bacchae,582,ἰὼ,2,"ἰὼ ἰὼ δέσποτα δέσποτα, μόλε νυν ἡμέτερον ἐς θίασον, ὦ Βρόμιε Βρόμιε."
Euripides,Bacchae,582,ὦ,10,"ἰὼ ἰὼ δέσποτα δέσποτα, μόλε νυν ἡμέτερον ἐς θίασον, ὦ Βρόμιε Βρόμιε."
Euripides,Bacchae,586,ἆ,1,"ἆ ἆ, τάχα τὰ Πενθέως μέλαθρα διατινάξεται πεσήμασιν."
Euripides,Bacchae,586,ἆ,2,"ἆ ἆ, τάχα τὰ Πενθέως μέλαθρα διατινάξεται πεσήμασιν."
Euripides,Bacchae,590,ὤ,2,_ σέβομεν ὤ.
Euripides,Bacchae,596,ἆ,1,"ἆ ἆ, πῦρ οὐ λεύσσεις, οὐδʼ αὐγάζῃ, Σεμέλας ἱερὸν ἀμφὶ τάφον, ἅν ποτε κεραυνόβολος ἔλιπε φλόγα Δίου βροντᾶς;"
Euripides,Bacchae,596,ἆ,2,"ἆ ἆ, πῦρ οὐ λεύσσεις, οὐδʼ αὐγάζῃ, Σεμέλας ἱερὸν ἀμφὶ τάφον, ἅν ποτε κεραυνόβολος ἔλιπε φλόγα Δίου βροντᾶς;"
Euripides,Bacchae,608,ὦ,1,"ὦ φάος μέγιστον ἡμῖν εὐίου βακχεύματος, ὡς ἐσεῖδον ἀσμένη σε, μονάδʼ ἔχουσʼ ἐρημίαν."
Euripides,Bacchae,1280,ἔα,1,ἔα ἔα·
Euripides,Bacchae,1280,ἔα,2,ἔα ἔα·
Euripides,Bacchae,717,Ὦ,1,"Ὦ σεμνὰς πλάκας ναίοντες ὀρέων, θέλετε θηρασώμεθα Πενθέως Ἀγαύην μητέρʼ ἐκ βακχευμάτων χάριν τʼ ἄνακτι θώμεθα;"
Euripides,Bacchae,731,Ὦ,1,"Ὦ δρομάδες ἐμαὶ κύνες, θηρώμεθʼ ἀνδρῶν τῶνδʼ ὕπʼ·"
Euripides,Bacchae,765,ὦ,7,"τὸν δαίμονʼ οὖν τόνδʼ ὅστις ἔστʼ, ὦ δέσποτα, δέχου πόλει τῇδʼ·"
Euripides,Bacchae,802,ὦ,1,"ὦ τᾶν, ἔτʼ ἔστιν εὖ καταστῆσαι τάδε."
Euripides,Bacchae,1248,οἴμοι,1,οἴμοι·
Euripides,Bacchae,1179,ἆ,1,ἆ.
Euripides,Bacchae,824,αὖ,4,εὖ γʼ εἶπας αὖ τόδʼ·
Euripides,Bacchae,985,ὦ,12,"Τίς ὅδʼ ὀρειδρόμων μαστὴρ Καδμείων ἐς ὄρος ἐς ὄρος ἔμολʼ ἔμολεν, ὦ βάκχαι;"
Euripides,Bacchae,1005,ὤ,1,"ὤ, νάει ν ἐπὶ τὰ καλὰ βίον, ἦμαρ ἐς νύκτα τʼ εὐαγοῦντʼ εὐσεβεῖν, τὰ δʼ ἔξω νόμιμα δίκας ἐκβαλόντα τιμᾶν θεούς."
Euripides,Bacchae,1020,ὦ,2,"ἴθʼ, ὦ Βάκχε, θηραγρευτᾷ βακχᾶν γελῶντι προσώπῳ περίβαλε βρόχον θανάσιμον ὑπʼ ἀγέλαν πεσόντι τὰν μαινάδων."
Euripides,Bacchae,1020,ὦ,1,"ὦ δῶμʼ ὃ πρίν ποτʼ εὐτύχεις ἀνʼ Ἑλλάδα, Σιδωνίου γέροντος, ὃς τὸ γηγενὲς δράκοντος ἔσπειρʼ Ὄφεος ἐν γαίᾳ θέρος, ὥς σε στενάζω, δοῦλος ὢν μέν, ἀλλʼ ὅμως τί δʼ ἔστιν;"
Euripides,Bacchae,1039,ὦ,9,"συγγνωστὰ μέν σοι, πλὴν ἐπʼ ἐξειργασμένοις κακοῖσι χαίρειν, ὦ γυναῖκες, οὐ καλόν."
Euripides,Bacchae,1058,Ὦ,1,"Ὦ ξένʼ, οὗ μὲν ἕσταμεν, οὐκ ἐξικνοῦμαι μαινάδων ὄσσοις νόθων·"
Euripides,Bacchae,1079,Ὦ,1,"Ὦ νεάνιδες, ἄγω τὸν ὑμᾶς κἀμὲ τἀμά τʼ ὄργια γέλων τιθέμενον·"
Euripides,Bacchae,1118,ὦ,3,"οἴκτιρε δʼ ὦ μῆτέρ με, μηδὲ ταῖς ἐμαῖς ἁμαρτίαισι παῖδα σὸν κατακτάνῃς."
Euripides,Bacchae,1133,ὤ,6,"Ἀσιάδες βάκχαι _ τί μʼ ὀροθύνεις, ὤ;"
Euripides,Bacchae,1200,ὦ,3,"δεῖξόν νυν, ὦ τάλαινα, σὴν νικηφόρον ἀστοῖσιν ἄγραν ἣν φέρουσʼ ἐλήλυθας."
Euripides,Bacchae,1202,ὦ,1,"ὦ καλλίπυργον ἄστυ Θηβαίας χθονὸς ναίοντες, ἔλθεθʼ ὡς ἴδητε τήνδʼ ἄγραν, Κάδμου θυγατέρες θηρὸς ἣν ἠγρεύσαμεν, οὐκ ἀγκυλητοῖς Θεσσαλῶν στοχάσμασιν, οὐ δικτύοισιν, ἀλλὰ λευκοπήχεσι χειρῶν ἀκμαῖσιν."
Euripides,Bacchae,1244,ὦ,1,"ὦ πένθος οὐ μετρητὸν οὐδʼ οἷόν τʼ ἰδεῖν, φόνον ταλαίναις χερσὶν ἐξειργασμένων."
Euripides,Bacchae,1248,οἴμοι,1,"οἴμοι κακῶν μὲν πρῶτα σῶν, ἔπειτʼ ἐμῶν·"
Euripides,Bacchae,1252,εἴθε,1,"εἴθε παῖς ἐμὸς εὔθηρος εἴη, μητρὸς εἰκασθεὶς τρόποις, ὅτʼ ἐν νεανίαισι Θηβαίοις ἅμα θηρῶν ὀριγνῷτ ̓·"
Euripides,Bacchae,1259,φεῦ,1,φεῦ φεῦ·
Euripides,Bacchae,1259,φεῦ,2,φεῦ φεῦ·
Euripides,Bacchae,1280,ἔα,1,"ἔα, τί λεύσσω;"
Euripides,Bacchae,1303,ὦ,24,"τοιγὰρ συνῆψε πάντας ἐς μίαν βλάβην, ὑμᾶς τε τόνδε θʼ, ὥστε διολέσαι δόμους κἄμʼ, ὅστις ἄτεκνος ἀρσένων παίδων γεγὼς τῆς σῆς τόδʼ ἔρνος, ὦ τάλαινα, νηδύος αἴσχιστα καὶ κάκιστα κατθανόνθʼ ὁρῶ, ᾧ δῶμʼ ἀνέβλεφʼ _ ὃς συνεῖχες, ὦ τέκνον, τοὐμὸν μέλαθρον, παιδὸς ἐξ ἐμῆς γεγώς, πόλει τε τάρβος ἦσθα·"
Euripides,Bacchae,1303,ὦ,37,"τοιγὰρ συνῆψε πάντας ἐς μίαν βλάβην, ὑμᾶς τε τόνδε θʼ, ὥστε διολέσαι δόμους κἄμʼ, ὅστις ἄτεκνος ἀρσένων παίδων γεγὼς τῆς σῆς τόδʼ ἔρνος, ὦ τάλαινα, νηδύος αἴσχιστα καὶ κάκιστα κατθανόνθʼ ὁρῶ, ᾧ δῶμʼ ἀνέβλεφʼ _ ὃς συνεῖχες, ὦ τέκνον, τοὐμὸν μέλαθρον, παιδὸς ἐξ ἐμῆς γεγώς, πόλει τε τάρβος ἦσθα·"
Euripides,Bacchae,1313,ὦ,1,"ὦ φίλτατʼ ἀνδρῶν _ καὶ γὰρ οὐκέτʼ ὢν ὅμως τῶν φιλτάτων ἔμοιγʼ ἀριθμήσῃ, τέκνον _ οὐκέτι γενείου τοῦδε θιγγάνων χερί, τὸν μητρὸς αὐδῶν πατέρα προσπτύξῃ, τέκνον, λέγων·"
Euripides,Bacchae,1322,ὦ,7,"λέγʼ, ὡς κολάζω τὸν ἀδικοῦντά σʼ, ὦ πάτερ."
Euripides,Bacchae,1329,ὦ,1,"ὦ πάτερ, ὁρᾷς γὰρ τἄμʼ ὅσῳ μετεστράφη δράκων γενήσῃ μεταβαλών, δάμαρ τε σὴ ἐκθηριωθεῖσʼ ὄφεος ἀλλάξει τύπον, ἣν Ἄρεος ἔσχες Ἁρμονίαν θνητὸς γεγώς."
Euripides,Bacchae,1350,αἰαῖ,1,"αἰαῖ, δέδοκται, πρέσβυ, τλήμονες φυγαί."
Euripides,Bacchae,1352,ὦ,1,"ὦ τέκνον, ὡς ἐς δεινὸν ἤλθομεν κακὸν πάντες, σύ θʼ ἡ τάλαινα σύγγονοί τε σαί, ἐγώ θʼ ὁ τλήμων·"
Euripides,Bacchae,1363,ὦ,1,"ὦ πάτερ, ἐγὼ δὲ σοῦ στερεῖσα φεύξομαι."
