author,text,location,interjection,sentence_position,sentence
Aristophanes,Acharnians,1030,ὦ,2,ἀλλʼ ὦ πόνηρʼ οὐ δημοσιεύων τυγχάνω.
Aristophanes,Acharnians,1036,οἴμοι,1,οἴμοι κακοδαίμων τοῖν γεωργοῖν βοιδίοιν.
Aristophanes,Acharnians,1058,ὦ,3,"ὡς γέλοιον ὦ θεοὶ τὸ δέημα τῆς νύμφης ὃ δεῖταί μου σφόδρα, ὅπως ἂν οἰκουρῇ τὸ πέος τοῦ νυμφίου."
Aristophanes,Acharnians,1063,ὦ,5,ὕπεχʼ ὧδε δεῦρο τοὐξάλειπτρον ὦ γύναι.
Aristophanes,Acharnians,1071,ἰὼ,1,ἰὼ πόνοι τε καὶ μάχαι καὶ Λάμαχοι.
Aristophanes,Acharnians,1078,ἰὼ,1,ἰὼ στρατηγοὶ πλείονες ἢ βελτίονες.
Aristophanes,Acharnians,1080,ἰὼ,1,ἰὼ στράτευμα πολεμολαμαχαϊκόν.
Aristophanes,Acharnians,1081,οἴμοι,1,οἴμοι κακοδαίμων καταγελᾷς ἤδη σύ μου.
Aristophanes,Acharnians,1083,αἰαῖ,1,αἰαῖ οἵαν ὁ κῆρυξ ἀγγελίαν ἤγγειλέ μοι.
Aristophanes,Acharnians,1084,αἰαῖ,1,αἰαῖ τίνα δʼ αὖ μοι προστρέχει τις ἀγγελῶν;
Aristophanes,Acharnians,1084,αὖ,4,αἰαῖ τίνα δʼ αὖ μοι προστρέχει τις ἀγγελῶν;
Aristophanes,Acharnians,1136,ὦ,3,τὰ στρώματʼ ὦ παῖ δῆσον ἐκ τῆς ἀσπίδος.
Aristophanes,Acharnians,1137,ὦ,3,τὸ δεῖπνον ὦ παῖ δῆσον ἐκ τῆς κιστίδος.
Aristophanes,Acharnians,1140,ὦ,6,τὴν ἀσπίδʼ αἴρου καὶ βάδιζʼ ὦ παῖ λαβών.
Aristophanes,Acharnians,1141,βαβαιάξ,1,βαβαιάξ·
Aristophanes,Acharnians,1174,ὦ,1,"ὦ δμῶες οἳ κατʼ οἶκόν ἐστε Λαμάχου, ὕδωρ ὕδωρ ἐν χυτριδίῳ θερμαίνετε·"
Aristophanes,Acharnians,1184,ὦ,1,"ὦ κλεινὸν ὄμμα νῦν πανύστατόν σʼ ἰδὼν λείπω φάος γε τοὐμόν, οὐκέτʼ εἰμʼ ἐγώ ̓."
Aristophanes,Acharnians,1190,ἀτταταῖ,1,ἀτταταῖ ἀτταταῖ στυγερὰ τάδε γε κρυερὰ πάθεα·
Aristophanes,Acharnians,1190,ἀτταταῖ,2,ἀτταταῖ ἀτταταῖ στυγερὰ τάδε γε κρυερὰ πάθεα·
Aristophanes,Acharnians,1198,ἀτταταῖ,1,"ἀτταταῖ ἀτταταῖ τῶν τιτθίων, ὡς σκληρὰ καὶ κυδώνια."
Aristophanes,Acharnians,1198,ἀτταταῖ,2,"ἀτταταῖ ἀτταταῖ τῶν τιτθίων, ὡς σκληρὰ καὶ κυδώνια."
Aristophanes,Acharnians,1200,ὦ,4,φιλήσατόν με μαλθακῶς ὦ χρυσίω τὸ περιπεταστὸν κἀπιμανδαλωτόν.
Aristophanes,Acharnians,1203-1204,ὦ,1,ὦ συμφορὰ τάλαινα τῶν ἐμῶν κακῶν.
Aristophanes,Acharnians,1205,ἰὼ,1,ἰὼ ἰὼ τραυμάτων ἐπωδύνων.
Aristophanes,Acharnians,1205,ἰὼ,2,ἰὼ ἰὼ τραυμάτων ἐπωδύνων.
Aristophanes,Acharnians,1206-1207,ἰὴ,1,ἰὴ ἰὴ χαῖρε Λαμαχίππιον.
Aristophanes,Acharnians,1206-1207,ἰὴ,2,ἰὴ ἰὴ χαῖρε Λαμαχίππιον.
Aristophanes,Acharnians,1212,ἰὼ,1,ἰὼ ἰὼ Παιὰν Παιάν.
Aristophanes,Acharnians,1212,ἰὼ,2,ἰὼ ἰὼ Παιὰν Παιάν.
Aristophanes,Acharnians,1214,παπαῖ,6,"λάβεσθέ μου λάβεσθε τοῦ σκέλους παπαῖ, προσλάβεσθʼ ὦ φίλοι."
Aristophanes,Acharnians,1214,ὦ,8,"λάβεσθέ μου λάβεσθε τοῦ σκέλους παπαῖ, προσλάβεσθʼ ὦ φίλοι."
Aristophanes,Acharnians,1216,ὦ,10,ἐμοῦ δέ γε σφὼ τοῦ πέους ἄμφω μέσου προσλάβεσθʼ ὦ φίλαι.
Aristophanes,Acharnians,1228,ὦ,6,"τήνελλα δῆτʼ, εἴπερ καλεῖς γʼ, ὦ πρέσβυ, καλλίνικος."
Aristophanes,Acharnians,1230,ὦ,3,τήνελλά νυν ὦ γεννάδα·
Aristophanes,Acharnians,1231,ὦ,4,ἕπεσθέ νυν ᾄδοντες ὦ τήνελλα καλλίνικος.
Aeschylus,Libation Bearers,18,ὦ,1,"ὦ Ζεῦ, δός με τείσασθαι μόρον πατρός, γενοῦ δὲ σύμμαχος θέλων ἐμοί."
Aeschylus,Libation Bearers,42,ἰὼ,6,"τοιάνδε χάριν ἀχάριτον ἀπότροπον κακῶν, ἰὼ γαῖα μαῖα, μωμένα μʼ ἰάλλει δύσθεος γυνά."
Aeschylus,Libation Bearers,49,ἰὼ,1,"ἰὼ πάνοιζυς ἑστία, ἰὼ κατασκαφαὶ δόμων."
Aeschylus,Libation Bearers,49,ἰὼ,4,"ἰὼ πάνοιζυς ἑστία, ἰὼ κατασκαφαὶ δόμων."
Aeschylus,Libation Bearers,100,ὦ,4,"τῆσδʼ ἐστὲ βουλῆς, ὦ φίλαι, μεταίτιαι·"
Aeschylus,Libation Bearers,156,ὦ,6,"κλύε δέ μοι, κλύε, σέβας ὦ δέσποτʼ, ἐξ ἀμαυρᾶς φρενός."
Aeschylus,Libation Bearers,394,φεῦ,1,φεῦ.
Aeschylus,Libation Bearers,195,εἴθʼ,1,"εἴθʼ εἶχε φωνὴν εὔφρονʼ ἀγγέλου δίκην, ὅπως δίφροντις οὖσα μὴʼκινυσσόμην, ἀλλʼ εὖ ̔ σαφήνει τόνδʼ ἀποπτύσαι πλόκον, εἴπερ γʼ ἀπʼ ἐχθροῦ κρατὸς ἦν τετμημένος, ἢ ξυγγενὴς ὢν εἶχε συμπενθεῖν ἐμοὶ ἄγαλμα τύμβου τοῦδε καὶ τιμὴν πατρός."
Aeschylus,Libation Bearers,220,ὦ,5,"ἀλλʼ ἦ δόλον τινʼ, ὦ ξένʼ, ἀμφί μοι πλέκεις;"
Aeschylus,Libation Bearers,235,ὦ,1,"ὦ φίλτατον μέλημα δώμασιν πατρός, δακρυτὸς ἐλπὶς σπέρματος σωτηρίου, ἀλκῇ πεποιθὼς δῶμʼ ἀνακτήσῃ πατρός."
Aeschylus,Libation Bearers,238,ὦ,1,ὦ τερπνὸν ὄμμα τέσσαρας μοίρας ἔχον ἐμοί·
Aeschylus,Libation Bearers,264,ὦ,1,"ὦ παῖδες, ὦ σωτῆρες ἑστίας πατρός, σιγᾶθʼ, ὅπως μὴ πεύσεταί τις, ὦ τέκνα, γλώσσης χάριν δὲ πάντʼ ἀπαγγείλῃ τάδε πρὸς τοὺς κρατοῦντας·"
Aeschylus,Libation Bearers,264,ὦ,3,"ὦ παῖδες, ὦ σωτῆρες ἑστίας πατρός, σιγᾶθʼ, ὅπως μὴ πεύσεταί τις, ὦ τέκνα, γλώσσης χάριν δὲ πάντʼ ἀπαγγείλῃ τάδε πρὸς τοὺς κρατοῦντας·"
Aeschylus,Libation Bearers,264,ὦ,12,"ὦ παῖδες, ὦ σωτῆρες ἑστίας πατρός, σιγᾶθʼ, ὅπως μὴ πεύσεταί τις, ὦ τέκνα, γλώσσης χάριν δὲ πάντʼ ἀπαγγείλῃ τάδε πρὸς τοὺς κρατοῦντας·"
Aeschylus,Libation Bearers,306,ὦ,2,"ἀλλʼ ὦ μεγάλαι Μοῖραι, Διόθεν τῇδε τελευτᾶν, τὸ δίκαιον μεταβαίνει."
Aeschylus,Libation Bearers,315,ὦ,1,"ὦ πάτερ αἰνόπατερ, τί σοι φάμενος ἢ τί ῥέξας τύχοιμʼ ἂν ἕκαθεν οὐρίσας, ἔνθα σʼ ἔχουσιν εὐναί, σκότῳ φάος ἀντίμοιρον;"
Aeschylus,Libation Bearers,332,ὦ,3,"κλῦθὶ νυν, ὦ πάτερ, ἐν μέρει πολυδάκρυτα πένθη."
Aeschylus,Libation Bearers,372,ὦ,3,"ταῦτα μέν, ὦ παῖ, κρείσσονα χρυσοῦ, μεγάλης δὲ τύχης καὶ ὑπερβορέου μείζονα φωνεῖς·"
Aeschylus,Libation Bearers,394,φεῦ,9,"καί πότʼ ἂν ἀμφιθαλὴς Ζεὺς ἐπὶ χεῖρα βάλοι, φεῦ φεῦ, κάρανα δαΐξας;"
Aeschylus,Libation Bearers,394,φεῦ,10,"καί πότʼ ἂν ἀμφιθαλὴς Ζεὺς ἐπὶ χεῖρα βάλοι, φεῦ φεῦ, κάρανα δαΐξας;"
Aeschylus,Libation Bearers,405,πόποι,1,"πόποι δὴ νερτέρων τυραννίδες, ἴδετε πολυκρατεῖς Ἀραὶ φθινομένων, ἴδεσθʼ Ἀτρειδᾶν τὰ λοίπʼ ἀμηχάνως ἔχοντα καὶ δωμάτων ἄτιμα."
Aeschylus,Libation Bearers,408,ὦ,5,"πᾷ τις τράποιτʼ ἄν, ὦ Ζεῦ;"
Aeschylus,Libation Bearers,429,ἰὼ,1,"ἰὼ δαΐα πάντολμε μᾶτερ, δαΐαις ἐν ἐκφοραῖς ἄνευ πολιτᾶν ἄνακτʼ, ἄνευ δὲ πενθημάτων ἔτλας ἀνοίμωκτον ἄνδρα θάψαι."
Aeschylus,Libation Bearers,434,οἴμοι,5,"τὸ πᾶν ἀτίμως ἔλεξας, οἴμοι."
Aeschylus,Libation Bearers,462,ἰὼ,1,"ἰὼ θεοί, κραίνετʼ ἐνδίκως δίκας."
Aeschylus,Libation Bearers,466,ὦ,1,ὦ πόνος ἐγγενὴς καὶ παράμουσος Ἄτας αἱματόεσσα πλαγά.
Aeschylus,Libation Bearers,469,ἰὼ,1,ἰὼ δύστονʼ ἄφερτα κήδη·
Aeschylus,Libation Bearers,470,ἰὼ,1,ἰὼ δυσκατάπαυστον ἄλγος.
Aeschylus,Libation Bearers,489,ὦ,1,"ὦ Γαῖʼ, ἄνες μοι πατέρʼ ἐποπτεῦσαι μάχην."
Aeschylus,Libation Bearers,490,ὦ,1,"ὦ Περσέφασσα, δὸς δʼ ἔτʼ εὔμορφον κράτος."
Aeschylus,Libation Bearers,523,ὦ,2,"οἶδʼ, ὦ τέκνον, παρῆ γάρ·"
Aeschylus,Libation Bearers,633,αὖ,6,ᾔκασεν δέ τις τὸ δεινὸν αὖ Λημνίοισι πήμασιν.
Aeschylus,Libation Bearers,654,ὦ,3,"τίς ἔνδον, ὦ παῖ, παῖ, μάλʼ αὖθις, ἐν δόμοις;"
Aeschylus,Libation Bearers,679,ὦ,7,"πεύθομαι γὰρ ἐν λόγῳ ἐπείπερ ἄλλως, ὦ ξένʼ, εἰς Ἄργος κίεις, πρὸς τοὺς τεκόντας πανδίκως μεμνημένος τεθνεῶτʼ Ὀρέστην εἰπέ, μηδαμῶς λάθῃ."
Aeschylus,Libation Bearers,691,οἲ,1,"οἲʼγώ, κατʼ ἄκρας εἶπας ὡς πορθούμεθα."
Aeschylus,Libation Bearers,692,ὦ,1,"ὦ δυσπάλαιστε τῶνδε δωμάτων Ἀρά, ὡς πόλλʼ ἐπωπᾷς, κἀκποδὼν εὖ κείμενα τόξοις πρόσωθεν εὐσκόποις χειρουμένη, φίλων ἀποψιλοῖς με τὴν παναθλίαν."
Aeschylus,Libation Bearers,722,ὦ,1,"ὦ πότνια χθὼν καὶ πότνιʼ ἀκτὴ χώματος, ἣ νῦν ἐπὶ ναυάρχῳ σώματι κεῖσαι τῷ βασιλείῳ, νῦν ἐπάκουσον, νῦν ἐπάρηξον·"
Aeschylus,Libation Bearers,743,ὦ,1,ὦ τάλαινʼ ἐγώ·
Aeschylus,Libation Bearers,787,ὦ,1,"ὦ Ζεῦ, σύ νιν φυλάσσοις."
Aeschylus,Libation Bearers,807,ὦ,5,"τὸ δὲ καλῶς κτίμενον ὦ μέγα ναίων στόμιον, εὖ δὸς ἀνιδεῖν δόμον ἀνδρός, καί νιν ἐλευθερίας φῶς λαμπρὸν ἰδεῖν φιλίοις ὄμμασιν ἐκ δνοφερᾶς καλύπτρας."
Aeschylus,Libation Bearers,851,αὖ,4,"ἰδεῖν ἐλέγξαι τʼ αὖ θέλω τὸν ἄγγελον, εἴτʼ αὐτὸς ἦν θνῄσκοντος ἐγγύθεν παρών, εἴτʼ ἐξ ἀμαυρᾶς κληδόνος λέγει μαθών."
Aeschylus,Libation Bearers,869,ἒ,1,"ἒ ἔ, ὀτοτοτοῖ."
Aeschylus,Libation Bearers,869,ἔ,2,"ἒ ἔ, ὀτοτοτοῖ."
Aeschylus,Libation Bearers,869,ὀτοτοτοῖ,3,"ἒ ἔ, ὀτοτοτοῖ."
Aeschylus,Libation Bearers,870,ἔα,1,ἔα ἔα μάλα·
Aeschylus,Libation Bearers,870,ἔα,2,ἔα ἔα μάλα·
Aeschylus,Libation Bearers,875,οἴμοι,1,"οἴμοι, πανοίμοι δεσπότου πεπληγμένου·"
Aeschylus,Libation Bearers,875,πανοίμοι,2,"οἴμοι, πανοίμοι δεσπότου πεπληγμένου·"
Aeschylus,Libation Bearers,876,οἴμοι,1,οἴμοι μάλʼ αὖθις ἐν τρίτοις προσφθέγμασιν.
Aeschylus,Libation Bearers,881,ἰοὺ,1,ἰοὺ ἰού.
Aeschylus,Libation Bearers,881,ἰού,2,ἰοὺ ἰού.
Aeschylus,Libation Bearers,893,οἲ,1,οἲʼγώ.
Aeschylus,Libation Bearers,893,οἲ,1,οἲʼγώ.
Aeschylus,Libation Bearers,896,ὦ,2,"ἐπίσχες, ὦ παῖ, τόνδε δʼ αἴδεσαι, τέκνον, μαστόν, πρὸς ᾧ σὺ πολλὰ δὴ βρίζων ἅμα οὔλοισιν ἐξήμελξας εὐτραφὲς γάλα."
Aeschylus,Libation Bearers,910,ὦ,4,"ἡ Μοῖρα τούτων, ὦ τέκνον, παραιτία."
Aeschylus,Libation Bearers,922,ὦ,3,"κτενεῖν ἔοικας, ὦ τέκνον, τὴν μητέρα."
Aeschylus,Libation Bearers,928,οἲ,1,οἲ ̔ γὼ τεκοῦσα τόνδʼ ὄφιν ἐθρεψάμην.
Aeschylus,Libation Bearers,942,ὦ,2,"ἐπολολύξατʼ ὦ δεσποσύνων δόμων ἀναφυγᾶς κακῶν καὶ κτεάνων τριβᾶς ὑπαὶ δυοῖν μιαστόροιν, δυσοίμου τύχας."
Aeschylus,Libation Bearers,942,ὦ,2,"ἐπολολύξατʼ ὦ δεσποσύνων δόμων ἀναφυγᾶς κακῶν καὶ κτεάνων τριβᾶς ὑπαὶ δυοῖν μιαστόροιν, δυσοίμου τύχας."
Aeschylus,Libation Bearers,1007,αἰαῖ,1,αἰαῖ αἰαῖ μελέων ἔργων·
Aeschylus,Libation Bearers,1007,αἰαῖ,2,αἰαῖ αἰαῖ μελέων ἔργων·
Aeschylus,Libation Bearers,1009,ἒ,1,"ἒ ἔ, μίμνοντι δὲ καὶ πάθος ἀνθεῖ."
Aeschylus,Libation Bearers,1009,ἔ,2,"ἒ ἔ, μίμνοντι δὲ καὶ πάθος ἀνθεῖ."
Aeschylus,Libation Bearers,1019,ἒ,1,"ἒ ἔ, μόχθος δʼ ὁ μὲν αὐτίχʼ, ὁ δʼ ἥξει."
Aeschylus,Libation Bearers,1019,ἔ,2,"ἒ ἔ, μόχθος δʼ ὁ μὲν αὐτίχʼ, ὁ δʼ ἥξει."
Aeschylus,Libation Bearers,1048,ἆ,1,"ἆ, ἆ."
Aeschylus,Libation Bearers,1048,ἆ,2,"ἆ, ἆ."
Aeschylus,Libation Bearers,1065,αὖ,7,ὅδε τοι μελάθροις τοῖς βασιλείοις τρίτος αὖ χειμὼν πνεύσας γονίας ἐτελέσθη.
Aeschylus,Libation Bearers,1073,αὖ,3,"νῦν δʼ αὖ τρίτος ἦλθέ ποθεν σωτήρ, ἢ μόρον εἴπω;"
Sophocles,Ajax,1,ὦ,3,"ἀεὶ μέν, ὦ παῖ Λαρτίου, δέδορκά σε πεῖράν τινʼ ἐχθρῶν ἁρπάσαι θηρώμενον·"
Sophocles,Ajax,14,ὦ,1,"ὦ φθέγμʼ Ἀθάνας, φιλτάτης ἐμοὶ θεῶν, ὡς εὐμαθές σου, κἂν ἄποπτος ᾖς ὅμως, φώνημʼ ἀκούω καὶ ξυναρπάζω φρενὶ χαλκοστόμου κώδωνος ὡς Τυρσηνικῆς."
Sophocles,Ajax,61,αὖ,8,"κἄπειτʼ ἐπειδὴ τοῦδʼ ἐλώφησεν πόνου, τοὺς ζῶντας αὖ δεσμοῖσι συνδήσας βοῶν ποίμνας τε πάσας εἰς δόμους κομίζεται, ὡς ἄνδρας, οὐχ ὡς εὔκερων ἄγραν ἔχων, καὶ νῦν κατʼ οἴκους συνδέτους αἰκίζεται."
Sophocles,Ajax,89,ὦ,1,"ὦ οὕτος, Αἴας, δεύτερόν σε προσκαλῶ."
Sophocles,Ajax,91,ὦ,1,"ὦ χαῖρʼ Ἀθάνα, χαῖρε Διογενὲς τέκνον, ὡς εὖ παρέστης·"
Sophocles,Ajax,105,ὦ,2,"ἥδιστος, ὦ δέσποινα, δεσμώτης ἔσω θακεῖ·"
Sophocles,Ajax,172,ὦ,7,"ἦ ῥά σε Ταυροπόλα Διὸς Ἄρτεμις _ ὦ μεγάλα φάτις, ὦ μᾶτερ αἰσχύνας ἐμᾶς _ ὥρμασε πανδάμους ἐπὶ βοῦς ἀγελαίας, ἦ πού τινος νίκας ἀκάρπωτον χάριν, ἤ ῥα κλυτῶν ἐνάρων ψευσθεῖσʼ, ἀδώροις, εἴτʼ ἐλαφαβολίας;"
Sophocles,Ajax,172,ὦ,10,"ἦ ῥά σε Ταυροπόλα Διὸς Ἄρτεμις _ ὦ μεγάλα φάτις, ὦ μᾶτερ αἰσχύνας ἐμᾶς _ ὥρμασε πανδάμους ἐπὶ βοῦς ἀγελαίας, ἦ πού τινος νίκας ἀκάρπωτον χάριν, ἤ ῥα κλυτῶν ἐνάρων ψευσθεῖσʼ, ἀδώροις, εἴτʼ ἐλαφαβολίας;"
Sophocles,Ajax,227,οἴμοι,1,οἴμοι φοβοῦμαι τὸ προσέρπον·
Sophocles,Ajax,1205,ὤμοι,1,ὤμοι·
Sophocles,Ajax,268,ὦ,4,"τό τοι διπλάζον, ὦ γύναι, μεῖζον κακόν."
Sophocles,Ajax,328,ὦ,2,"ἀλλʼ, ὦ φίλοι, τούτων γὰρ οὕνεκʼ ἐστάλην, ἀρήξατʼ εἰσελθόντες, εἰ δύνασθέ τι·"
Sophocles,Ajax,333,ἰώ,1,ἰώ μοί μοι.
Sophocles,Ajax,336,ἰώ,1,ἰώ μοί μοι.
Sophocles,Ajax,339,ἰὼ,1,ἰὼ παῖ παῖ.
Sophocles,Ajax,339,ὤμοι,1,ὤμοι τάλαινʼ·
Sophocles,Ajax,348,ἰὼ,1,"ἰὼ φίλοι ναυβάται, μόνοι ἐμῶν φίλων, μόνοι ἔτʼ ἐμμένοντες ὀρθῷ νόμῳ, ἴδεσθέ μʼ οἷον ἄρτι κῦμα φοινίας ὑπὸ ζάλης ἀμφίδρομον κυκλεῖται."
Sophocles,Ajax,356,ἰὼ,1,"ἰὼ γένος ναΐας ἀρωγὸν τέχνας, ἅλιον ὃς ἐπέβας ἑλίσσων πλάταν, σέ τοι σέ τοι μόνον δέδορκα πημονὰν ἐπαρκέσοντʼ·"
Sophocles,Ajax,367,ὤμοι,1,"ὤμοι γέλωτος, οἷον ὑβρίσθην ἄρα."
Sophocles,Ajax,430,αἰαῖ,1,αἰαῖ αἰαῖ.
Sophocles,Ajax,430,αἰαῖ,2,αἰαῖ αἰαῖ.
Sophocles,Ajax,371,ὦ,1,ὦ πρὸς θεῶν ὕπεικε καὶ φρόνησον εὖ.
Sophocles,Ajax,372,ὦ,1,"ὦ δύσμορος, ὃς χερὶ μὲν μεθῆκα τοὺς ἀλάστορας, ἐν δʼ ἑλίκεσσι βουσὶ καὶ κλυτοῖς πεσὼν αἰπολίοις ἐρεμνὸν αἷμʼ ἔδευσα."
Sophocles,Ajax,379,ἰὼ,1,"ἰὼ πάνθʼ ὁρῶν ἁπάντων τʼ ἀεὶ κακῶν ὄργανον, τέκνον Λαρτίου, κακοπινέστατόν τʼ ἄλημα στρατοῦ, ἦ που πολὺν γέλωθʼ ὑφʼ ἡδονῆς ἄγεις."
Sophocles,Ajax,384,ἰώ,1,ἰώ μοί μοι.
Sophocles,Ajax,387,ὦ,1,"ὦ Ζεῦ, προγόνων προπάτωρ, πῶς ἂν τὸν αἱμυλώτατον, ἐχθρὸν ἄλημα, τούς τε δισσάρχας ὀλέσσας βασιλῆς τέλος θάνοιμι καὐτός;"
Sophocles,Ajax,394,ἰὼ,1,"ἰὼ σκότος, ἐμὸν φάος, ἔρεβος ὦ φαεννότατον, ὡς ἐμοί, ἕλεσθʼ ἕλεσθέ μʼ οἰκήτορα, ἕλεσθέ μʼ·"
Sophocles,Ajax,394,ὦ,6,"ἰὼ σκότος, ἐμὸν φάος, ἔρεβος ὦ φαεννότατον, ὡς ἐμοί, ἕλεσθʼ ἕλεσθέ μʼ οἰκήτορα, ἕλεσθέ μʼ·"
Sophocles,Ajax,410,ὦ,1,"ὦ δυστάλαινα, τοιάδʼ ἄνδρα χρήσιμον φωνεῖν, ἃ πρόσθεν οὗτος οὐκ ἔτλη ποτʼ ἄν."
Sophocles,Ajax,412,ἰὼ,1,"ἰὼ πόροι ἁλίρροθοι πάραλά τʼ ἄντρα καὶ νέμος ἐπάκτιον, πολὺν πολύν με δαρόν τε δὴ κατείχετʼ ἀμφὶ Τροίαν χρόνον·"
Sophocles,Ajax,418,ὦ,1,"ὦ Σκαμάνδριοι γείτονες ῥοαί, εὔφρονες Ἀργείοις, οὐκέτʼ ἄνδρα μὴ τόνδʼ ἴδητʼ, ἔπος ἐξερῶ μέγʼ, οἷον οὔτινα Τροία στρατοῦ δέρχθη χθονὸς μολόντʼ ἀπὸ Ἑλλανίδος·"
Sophocles,Ajax,430,αἰαῖ,1,αἰαῖ·
Sophocles,Ajax,485,ὦ,1,"ὦ δέσποτʼ Αἴας, τῆς ἀναγκαίας τύχης οὐκ ἔστιν οὐδὲν μεῖζον ἀνθρώποις κακόν."
Sophocles,Ajax,529,ὦ,2,"ἀλλʼ ὦ φίλʼ Αἴας, πάντʼ ἔγωγε πείσομαι."
Sophocles,Ajax,541,ὦ,1,"ὦ παῖ, πατὴρ καλεῖ σε."
Sophocles,Ajax,550,ὦ,1,"ὦ παῖ, γένοιο πατρὸς εὐτυχέστερος, τὰ δʼ ἄλλʼ ὅμοιος·"
Sophocles,Ajax,585,ὦ,1,"ὦ δέσποτʼ Αἴας, τί ποτε δρασείεις φρενί;"
Sophocles,Ajax,596,ὦ,1,"ὦ κλεινὰ Σαλαμίς, σὺ μέν που ναίεις ἁλίπλακτος, εὐδαίμων, πᾶσιν περίφαντος ἀεί·"
Sophocles,Ajax,607,ὤμοι,7,"καί μοι δυσθεράπευτος Αἴας ξύνεστιν ἔφεδρος, ὤμοι μοι, θείᾳ μανίᾳ ξύναυλος·"
Sophocles,Ajax,613-614,αὖ,3,νῦν δʼ αὖ φρενὸς οἰοβώτας φίλοις μέγα πένθος ηὕρηται.
Sophocles,Ajax,641,ὦ,1,"ὦ τλᾶμον πάτερ, οἵαν σε μένει πυθέσθαι παιδὸς δύσφορον ἄταν, ἃν οὔπω τις ἔθρεψεν αἰὼν Αἰακιδᾶν ἄτερθε τοῦδε."
Sophocles,Ajax,693,ἰὼ,1,"ἰὼ ἰὼ Πὰν Πάν, ὦ Πὰν Πὰν ἁλίπλαγκτε, Κυλλανίας χιονοκτύπου πετραίας ἀπὸ δειράδος φάνηθʼ, ὦ θεῶν χοροποίʼ ἄναξ, ὅπως μοι Νύσια Κνώσι ̓ ὀρχήματʼ αὐτοδαῆ ξυνὼν ἰάψῃς·"
Sophocles,Ajax,693,ἰὼ,2,"ἰὼ ἰὼ Πὰν Πάν, ὦ Πὰν Πὰν ἁλίπλαγκτε, Κυλλανίας χιονοκτύπου πετραίας ἀπὸ δειράδος φάνηθʼ, ὦ θεῶν χοροποίʼ ἄναξ, ὅπως μοι Νύσια Κνώσι ̓ ὀρχήματʼ αὐτοδαῆ ξυνὼν ἰάψῃς·"
Sophocles,Ajax,693,ὦ,5,"ἰὼ ἰὼ Πὰν Πάν, ὦ Πὰν Πὰν ἁλίπλαγκτε, Κυλλανίας χιονοκτύπου πετραίας ἀπὸ δειράδος φάνηθʼ, ὦ θεῶν χοροποίʼ ἄναξ, ὅπως μοι Νύσια Κνώσι ̓ ὀρχήματʼ αὐτοδαῆ ξυνὼν ἰάψῃς·"
Sophocles,Ajax,693,ὦ,15,"ἰὼ ἰὼ Πὰν Πάν, ὦ Πὰν Πὰν ἁλίπλαγκτε, Κυλλανίας χιονοκτύπου πετραίας ἀπὸ δειράδος φάνηθʼ, ὦ θεῶν χοροποίʼ ἄναξ, ὅπως μοι Νύσια Κνώσι ̓ ὀρχήματʼ αὐτοδαῆ ξυνὼν ἰάψῃς·"
Sophocles,Ajax,706,ἰὼ,1,"ἰὼ ἰώ, νῦν αὖ, νῦν, ὦ Ζεῦ, πάρα λευκὸν εὐάμερον πελάσαι φάος θοᾶν ὠκυάλων νεῶν, ὅτʼ Αἴας λαθίπονος πάλιν, θεῶν δʼ αὖ πάνθυτα θέσμιʼ ἐξήνυσʼ εὐνομίᾳ σέβων μεγίστᾳ."
Sophocles,Ajax,706,ἰώ,2,"ἰὼ ἰώ, νῦν αὖ, νῦν, ὦ Ζεῦ, πάρα λευκὸν εὐάμερον πελάσαι φάος θοᾶν ὠκυάλων νεῶν, ὅτʼ Αἴας λαθίπονος πάλιν, θεῶν δʼ αὖ πάνθυτα θέσμιʼ ἐξήνυσʼ εὐνομίᾳ σέβων μεγίστᾳ."
Sophocles,Ajax,706,αὖ,4,"ἰὼ ἰώ, νῦν αὖ, νῦν, ὦ Ζεῦ, πάρα λευκὸν εὐάμερον πελάσαι φάος θοᾶν ὠκυάλων νεῶν, ὅτʼ Αἴας λαθίπονος πάλιν, θεῶν δʼ αὖ πάνθυτα θέσμιʼ ἐξήνυσʼ εὐνομίᾳ σέβων μεγίστᾳ."
Sophocles,Ajax,706,ὦ,6,"ἰὼ ἰώ, νῦν αὖ, νῦν, ὦ Ζεῦ, πάρα λευκὸν εὐάμερον πελάσαι φάος θοᾶν ὠκυάλων νεῶν, ὅτʼ Αἴας λαθίπονος πάλιν, θεῶν δʼ αὖ πάνθυτα θέσμιʼ ἐξήνυσʼ εὐνομίᾳ σέβων μεγίστᾳ."
Sophocles,Ajax,706,αὖ,22,"ἰὼ ἰώ, νῦν αὖ, νῦν, ὦ Ζεῦ, πάρα λευκὸν εὐάμερον πελάσαι φάος θοᾶν ὠκυάλων νεῶν, ὅτʼ Αἴας λαθίπονος πάλιν, θεῶν δʼ αὖ πάνθυτα θέσμιʼ ἐξήνυσʼ εὐνομίᾳ σέβων μεγίστᾳ."
Sophocles,Ajax,737,ἰοὺ,1,ἰοὺ ἰού·
Sophocles,Ajax,737,ἰού,2,ἰοὺ ἰού·
Sophocles,Ajax,784,ὦ,1,"ὦ δαΐα Τέκμησσα, δύσμορον γένος, ὅρα μολοῦσα τόνδʼ ὁποῖʼ ἔπη θροεῖ·"
Sophocles,Ajax,787,αὖ,3,"τί μʼ αὖ τάλαιναν, ἀρτίως πεπαυμένην κακῶν ἀτρύτων, ἐξ ἕδρας ἀνίστατε;"
Sophocles,Ajax,791,οἴμοι,1,"οἴμοι, τί φής, ἄνθρωπε;"
Sophocles,Ajax,800,οἴμοι,1,"οἴμοι τάλαινα, τοῦ ποτʼ ἀνθρώπων μαθών;"
Sophocles,Ajax,803,οἲ,1,"οἲʼγώ, φίλοι, πρόστητʼ ἀναγκαίας τύχης, καὶ σπεύσαθʼ, οἱ μὲν Τεῦκρον ἐν τάχει μολεῖν, οἱ δʼ ἑσπέρους ἀγκῶνας, οἱ δʼ ἀντηλίους ζητεῖτʼ ἰόντες τἀνδρὸς ἔξοδον κακήν."
Sophocles,Ajax,809,οἴμοι,1,"οἴμοι, τί δράσω, τέκνον;"
Sophocles,Ajax,823,ὦ,7,"ἐκ δὲ τῶνδέ μοι σὺ πρῶτος, ὦ Ζεῦ, καὶ γὰρ εἰκός, ἄρκεσον."
