author,text,location,interjection,sentence_position,sentence
Sophocles,Oedipus Tyrannus,1086,ὦ,13,"εἴπερ ἐγὼ μάντις εἰμὶ καὶ κατὰ γνώμαν ἴδρις, οὐ τὸν Ὄλυμπον ἀπείρων, ὦ Κιθαιρών, οὐκ ἔσει τὰν αὔριον πανσέληνον, μὴ οὐ σέ γε καὶ πατριώταν Οἰδίπουν καὶ τροφὸν καὶ ματέρʼ αὔξειν, καὶ χορεύεσθαι πρὸς ἡμῶν, ὡς ἐπὶ ἦρα φέροντα τοῖς ἐμοῖς τυράννοις."
Sophocles,Oedipus Tyrannus,1102-1103,εἴθʼ,1,"εἴθʼ ὁ Κυλλάνας ἀνάσσων, εἴθʼ ὁ Βακχεῖος θεὸς ναίων ἐπʼ ἄκρων ὀρέων σʼ εὕρημα δέξατʼ ἔκ του Νυμφᾶν Ἑλικωνίδων, αἷς πλεῖστα συμπαίζει."
Sophocles,Oedipus Tyrannus,1102-1103,εἴθʼ,5,"εἴθʼ ὁ Κυλλάνας ἀνάσσων, εἴθʼ ὁ Βακχεῖος θεὸς ναίων ἐπʼ ἄκρων ὀρέων σʼ εὕρημα δέξατʼ ἔκ του Νυμφᾶν Ἑλικωνίδων, αἷς πλεῖστα συμπαίζει."
Sophocles,Oedipus Tyrannus,1145,ὦ,3,"ὅδʼ ἐστίν, ὦ τᾶν, κεῖνος ὃς τότʼ ἦν νέος."
Sophocles,Oedipus Tyrannus,1147,ἆ,1,"ἆ, μὴ κόλαζε, πρέσβυ, τόνδʼ, ἐπεὶ τὰ σὰ δεῖται κολαστοῦ μᾶλλον ἢ τὰ τοῦδʼ ἔπη."
Sophocles,Oedipus Tyrannus,1149,ὦ,3,"τί δʼ, ὦ φέριστε δεσποτῶν, ἁμαρτάνω;"
Sophocles,Oedipus Tyrannus,1169,οἴμοι,1,"οἴμοι, πρὸς αὐτῷ γʼ εἰμὶ τῷ δεινῷ λέγειν."
Sophocles,Oedipus Tyrannus,1178,ὦ,2,"κατοικτίσας, ὦ δέσποθʼ, ὡς ἄλλην χθόνα δοκῶν ἀποίσειν, αὐτὸς ἔνθεν ἦν·"
Sophocles,Oedipus Tyrannus,1182,ἰοὺ,1,ἰοὺ ἰού·
Sophocles,Oedipus Tyrannus,1182,ἰού,2,ἰοὺ ἰού·
Sophocles,Oedipus Tyrannus,1183,ὦ,1,"ὦ φῶς, τελευταῖόν σε προσβλέψαιμι νῦν, ὅστις πέφασμαι φύς τʼ ἀφʼ ὧν οὐ χρῆν, ξὺν οἷς τʼ οὐ χρῆν ὁμιλῶν, οὕς τέ μʼ οὐκ ἔδει κτανών."
Sophocles,Oedipus Tyrannus,1186,ἰὼ,1,"ἰὼ γενεαὶ βροτῶν, ὡς ὑμᾶς ἴσα καὶ τὸ μηδὲν ζώσας ἐναριθμῶ."
Sophocles,Oedipus Tyrannus,1193,ὦ,11,"τὸν σόν τοι παράδειγμʼ ἔχων, τὸν σὸν δαίμονα, τὸν σόν, ὦ τλᾶμον Οἰδιπόδα, βροτῶν οὐδὲν μακαρίζω·"
Sophocles,Oedipus Tyrannus,1196,ὦ,10,"ὅστις καθʼ ὑπερβολὰν τοξεύσας ἐκράτησε τοῦ πάντʼ εὐδαίμονος ὄλβου, ὦ Ζεῦ, κατὰ μὲν φθίσας τὰν γαμψώνυχα παρθένον χρησμῳδόν, θανάτων δʼ ἐμᾷ χώρᾳ πύργος ἀνέστα·"
Sophocles,Oedipus Tyrannus,1208,ἰὼ,1,"ἰὼ κλεινὸν Οἰδίπου κάρα, ἦ στέγας λιμὴν αὑτὸς ἤρκεσεν παιδὶ καὶ πατρὶ θαλαμηπόλῳ πεσεῖν;"
Sophocles,Oedipus Tyrannus,1216,ἰώ,1,"ἰώ, Λαΐειον ὦ τέκνον, εἴθε σʼ εἴθε σε μήποτʼ εἰδόμαν."
Sophocles,Oedipus Tyrannus,1216,ὦ,3,"ἰώ, Λαΐειον ὦ τέκνον, εἴθε σʼ εἴθε σε μήποτʼ εἰδόμαν."
Sophocles,Oedipus Tyrannus,1216,εἴθε,5,"ἰώ, Λαΐειον ὦ τέκνον, εἴθε σʼ εἴθε σε μήποτʼ εἰδόμαν."
Sophocles,Oedipus Tyrannus,1216,εἴθε,7,"ἰώ, Λαΐειον ὦ τέκνον, εἴθε σʼ εἴθε σε μήποτʼ εἰδόμαν."
Sophocles,Oedipus Tyrannus,1222,ὦ,1,"ὦ γῆς μέγιστα τῆσδʼ ἀεὶ τιμώμενοι, οἷʼ, ἔργʼ ἀκούσεσθʼ, οἷα δʼ εἰσόψεσθʼ, ὅσον δʼ ἀρεῖσθε πένθος, εἴπερ ἐγγενῶς ἔτι τῶν Λαβδακείων ἐντρέπεσθε δωμάτων."
Sophocles,Oedipus Tyrannus,1236,ὦ,1,"ὦ δυστάλαινα, πρὸς τίνος ποτʼ αἰτίας;"
Sophocles,Oedipus Tyrannus,1297,ὦ,1,"ὦ δεινὸν ἰδεῖν πάθος ἀνθρώποις, ὦ δεινότατον πάντων ὅσʼ ἐγὼ προσέκυρσʼ ἤδη."
Sophocles,Oedipus Tyrannus,1297,ὦ,6,"ὦ δεινὸν ἰδεῖν πάθος ἀνθρώποις, ὦ δεινότατον πάντων ὅσʼ ἐγὼ προσέκυρσʼ ἤδη."
Sophocles,Oedipus Tyrannus,1299,ὦ,3,"τίς σʼ, ὦ τλῆμον, προσέβη μανία;"
Sophocles,Oedipus Tyrannus,1322,φεῦ,1,"φεῦ φεῦ, δύστανʼ·"
Sophocles,Oedipus Tyrannus,1322,φεῦ,2,"φεῦ φεῦ, δύστανʼ·"
Sophocles,Oedipus Tyrannus,1307,αἰαῖ,1,"αἰαῖ αἰαῖ, δύστανος ἐγώ, ποῖ γᾶς φέρομαι τλάμων;"
Sophocles,Oedipus Tyrannus,1307,αἰαῖ,2,"αἰαῖ αἰαῖ, δύστανος ἐγώ, ποῖ γᾶς φέρομαι τλάμων;"
Sophocles,Oedipus Tyrannus,1308,ἰὼ,1,"ἰὼ δαῖμον, ἵνʼ ἐξήλλου."
Sophocles,Oedipus Tyrannus,1313,ἰὼ,1,"ἰὼ σκότου νέφος ἐμὸν ἀπότροπον, ἐπιπλόμενον ἄφατον, ἀδάματόν τε καὶ δυσούριστον ὄν."
Sophocles,Oedipus Tyrannus,1316,οἴμοι,1,"οἴμοι, οἴμοι μάλʼ αὖθις·"
Sophocles,Oedipus Tyrannus,1316,οἴμοι,2,"οἴμοι, οἴμοι μάλʼ αὖθις·"
Sophocles,Oedipus Tyrannus,1321,ἰὼ,1,"ἰὼ φίλος, σὺ μὲν ἐμὸς ἐπίπολος ἔτι μόνιμος·"
Sophocles,Oedipus Tyrannus,1322,φεῦ,1,φεῦ φεῦ.
Sophocles,Oedipus Tyrannus,1322,φεῦ,2,φεῦ φεῦ.
Sophocles,Oedipus Tyrannus,1327,ὦ,1,"ὦ δεινὰ δράσας, πῶς ἔτλης τοιαῦτα σὰς ὄψεις μαρᾶναι;"
Sophocles,Oedipus Tyrannus,1338,ὦ,8,"ἀπάγετʼ ἐκτόπιον ὅ τι τάχιστά με, ἀπάγετʼ, ὦ φίλοι, τὸν μέγʼ ὀλέθριον τὸν καταρατότατον, ἔτι δὲ καὶ θεοῖς ἐχθρότατον βροτῶν."
Sophocles,Oedipus Tyrannus,1371,αὖ,16,"ἐγὼ γὰρ οὐκ οἶδʼ ὄμμασιν ποίοις βλέπων πατέρα ποτʼ ἂν προσεῖδον εἰς Ἅιδου μολὼν οὐδʼ αὖ τάλαιναν μητέρʼ, οἷν ἐμοὶ δυοῖν ἔργʼ ἐστὶ κρείσσονʼ ἀγχόνης εἰργασμένα."
Sophocles,Oedipus Tyrannus,1391,ἰὼ,1,"ἰὼ Κιθαιρών, τί μʼ ἐδέχου;"
Sophocles,Oedipus Tyrannus,1394,ὦ,1,"ὦ Πόλυβε καὶ Κόρινθε καὶ τὰ πάτρια λόγῳ παλαιὰ δώμαθʼ, οἷον ἆρά με κάλλος κακῶν ὕπουλον ἐξεθρέψατε·"
Sophocles,Oedipus Tyrannus,1398,ὦ,1,"ὦ τρεῖς κέλευθοι καὶ κεκρυμμένη νάπη δρυμός τε καὶ στενωπὸς ἐν τριπλαῖς ὁδοῖς, αἳ τοὐμὸν αἷμα τῶν ἐμῶν χειρῶν ἄπο ἐπίετε πατρός, ἆρά μου μέμνησθʼ ἔτι οἷʼ ἔργα δράσας ὑμὶν εἶτα δεῦρʼ ἰὼν ὁποῖʼ ἔπρασσον αὖθις;"
Sophocles,Oedipus Tyrannus,1419,οἴμοι,1,"οἴμοι, τί δῆτα λέξομεν πρὸς τόνδʼ ἔπος;"
Sophocles,Oedipus Tyrannus,1468,ὦ,4,"ἴθʼ ὦναξ, ἴθʼ ὦ γονῇ γενναῖε·"
Sophocles,Oedipus Tyrannus,1480,ὦ,1,"ὦ τέκνα, ποῦ ποτʼ ἐστέ;"
Sophocles,Oedipus Tyrannus,1484,ὦ,3,"ὃς ὑμίν, ὦ τέκνʼ, οὔθʼ ὁρῶν οὔθʼ ἱστορῶν πατὴρ ἐφάνθην ἔνθεν αὐτὸς ἠρόθην."
Sophocles,Oedipus Tyrannus,1501,ὦ,4,"οὐκ ἔστιν οὐδείς, ὦ τέκνʼ, ἀλλὰ δηλαδὴ χέρσους φθαρῆναι κἀγάμους ὑμᾶς χρεών."
Sophocles,Oedipus Tyrannus,1503,ὦ,1,"ὦ παῖ Μενοικέως, ἀλλʼ ἐπεὶ μόνος πατὴρ ταύταιν λέλειψαι, νὼ γάρ, ὣʼφυτεύσαμεν, ὀλώλαμεν δύʼ ὄντε, μή σφε περιίδῃς πτωχὰς ἀνάνδρους ἐκγενεῖς ἀλωμένας, μηδʼ ἐξισώσῃς τάσδε τοῖς ἐμοῖς κακοῖς."
Sophocles,Oedipus Tyrannus,1510,ὦ,2,"ξύννευσον, ὦ γενναῖε, σῇ ψαύσας χερί."
Sophocles,Oedipus Tyrannus,1524,ὦ,1,"ὦ πάτρας Θήβης ἔνοικοι, λεύσσετʼ, Οἰδίπους ὅδε, ὃς τὰ κλείνʼ αἰνίγματʼ ᾔδει καὶ κράτιστος ἦν ἀνήρ, οὗ τίς οὐ ζήλῳ πολιτῶν ἦν τύχαις ἐπιβλέπων, εἰς ὅσον κλύδωνα δεινῆς συμφορᾶς ἐλήλυθεν."
Aeschylus,Prometheus Bound,45,ὦ,1,ὦ πολλὰ μισηθεῖσα χειρωναξία.
Aeschylus,Prometheus Bound,66,αἰαῖ,1,"αἰαῖ, Προμηθεῦ, σῶν ὑπερστένω πόνων."
Aeschylus,Prometheus Bound,67,αὖ,3,σὺ δʼ αὖ κατοκνεῖς τῶν Διός τʼ ἐχθρῶν ὕπερ στένεις;
Aeschylus,Prometheus Bound,88,ὦ,1,"ὦ δῖος αἰθὴρ καὶ ταχύπτεροι πνοαί, ποταμῶν τε πηγαί, ποντίων τε κυμάτων ἀνήριθμον γέλασμα, παμμῆτόρ τε γῆ, καὶ τὸν πανόπτην κύκλον ἡλίου καλῶ."
Aeschylus,Prometheus Bound,98,φεῦ,1,"φεῦ φεῦ, τὸ παρὸν τό τʼ ἐπερχόμενον πῆμα στενάχω, πῇ ποτε μόχθων χρὴ τέρματα τῶνδʼ ἐπιτεῖλαι."
Aeschylus,Prometheus Bound,98,φεῦ,2,"φεῦ φεῦ, τὸ παρὸν τό τʼ ἐπερχόμενον πῆμα στενάχω, πῇ ποτε μόχθων χρὴ τέρματα τῶνδʼ ἐπιτεῖλαι."
Aeschylus,Prometheus Bound,112,ἆ,1,ἆ ἆ ἔα ἔα.
Aeschylus,Prometheus Bound,112,ἆ,2,ἆ ἆ ἔα ἔα.
Aeschylus,Prometheus Bound,124,φεῦ,1,"φεῦ φεῦ, τί ποτʼ αὖ κινάθισμα κλύω πέλας οἰωνῶν;"
Aeschylus,Prometheus Bound,124,φεῦ,2,"φεῦ φεῦ, τί ποτʼ αὖ κινάθισμα κλύω πέλας οἰωνῶν;"
Aeschylus,Prometheus Bound,124,αὖ,5,"φεῦ φεῦ, τί ποτʼ αὖ κινάθισμα κλύω πέλας οἰωνῶν;"
Aeschylus,Prometheus Bound,136,αἰαῖ,1,"αἰαῖ αἰαῖ, τῆς πολυτέκνου Τηθύος ἔκγονα, τοῦ περὶ πᾶσάν θʼ εἱλισσομένου χθόνʼ ἀκοιμήτῳ ῥεύματι παῖδες πατρὸς, Ὠκεανοῦ, δέρχθητʼ, ἐσίδεσθʼ οἵῳ δεσμῷ, προσπορπατὸς τῆσδε φάραγγος σκοπέλοις ἐν ἄκροις φρουρὰν ἄζηλον ὀχήσω."
Aeschylus,Prometheus Bound,136,αἰαῖ,2,"αἰαῖ αἰαῖ, τῆς πολυτέκνου Τηθύος ἔκγονα, τοῦ περὶ πᾶσάν θʼ εἱλισσομένου χθόνʼ ἀκοιμήτῳ ῥεύματι παῖδες πατρὸς, Ὠκεανοῦ, δέρχθητʼ, ἐσίδεσθʼ οἵῳ δεσμῷ, προσπορπατὸς τῆσδε φάραγγος σκοπέλοις ἐν ἄκροις φρουρὰν ἄζηλον ὀχήσω."
Aeschylus,Prometheus Bound,687,ἔα,1,ἔα·
Aeschylus,Prometheus Bound,315,ὦ,2,"ἀλλʼ, ὦ ταλαίπωρʼ, ἃς ἔχεις ὀργὰς ἄφες, ζήτει δὲ τῶνδε πημάτων ἀπαλλαγάς."
Aeschylus,Prometheus Bound,384,ἔα,1,"ἔα με τῇδε τῇ νόσῳ νοσεῖν, ἐπεὶ κέρδιστον εὖ φρονοῦντα μὴ φρονεῖν δοκεῖν."
Aeschylus,Prometheus Bound,537,ὦ,5,"φέρʼ, ὅπως ἄχαρις χάρις, ὦ φίλος·"
Aeschylus,Prometheus Bound,566,ἆ,1,"ἆ ἆ, ἒ ἔ, χρίει τις αὖ με τὰν τάλαιναν οἶστρος, εἴδωλον Ἄργου γηγενοῦς, ἄλευʼ ἆ δᾶ·"
Aeschylus,Prometheus Bound,566,ἆ,2,"ἆ ἆ, ἒ ἔ, χρίει τις αὖ με τὰν τάλαιναν οἶστρος, εἴδωλον Ἄργου γηγενοῦς, ἄλευʼ ἆ δᾶ·"
Aeschylus,Prometheus Bound,566,ἒ,3,"ἆ ἆ, ἒ ἔ, χρίει τις αὖ με τὰν τάλαιναν οἶστρος, εἴδωλον Ἄργου γηγενοῦς, ἄλευʼ ἆ δᾶ·"
Aeschylus,Prometheus Bound,566,ἔ,4,"ἆ ἆ, ἒ ἔ, χρίει τις αὖ με τὰν τάλαιναν οἶστρος, εἴδωλον Ἄργου γηγενοῦς, ἄλευʼ ἆ δᾶ·"
Aeschylus,Prometheus Bound,566,αὖ,7,"ἆ ἆ, ἒ ἔ, χρίει τις αὖ με τὰν τάλαιναν οἶστρος, εἴδωλον Ἄργου γηγενοῦς, ἄλευʼ ἆ δᾶ·"
Aeschylus,Prometheus Bound,566,ἆ,16,"ἆ ἆ, ἒ ἔ, χρίει τις αὖ με τὰν τάλαιναν οἶστρος, εἴδωλον Ἄργου γηγενοῦς, ἄλευʼ ἆ δᾶ·"
Aeschylus,Prometheus Bound,566,δᾶ,17,"ἆ ἆ, ἒ ἔ, χρίει τις αὖ με τὰν τάλαιναν οἶστρος, εἴδωλον Ἄργου γηγενοῦς, ἄλευʼ ἆ δᾶ·"
Aeschylus,Prometheus Bound,576,ἰὼ,1,"ἰὼ ἰὼ πόποι, ποῖ μʼ ἄγουσι τηλέπλαγκτοι πλάναι;"
Aeschylus,Prometheus Bound,576,ἰὼ,2,"ἰὼ ἰὼ πόποι, ποῖ μʼ ἄγουσι τηλέπλαγκτοι πλάναι;"
Aeschylus,Prometheus Bound,576,πόποι,3,"ἰὼ ἰὼ πόποι, ποῖ μʼ ἄγουσι τηλέπλαγκτοι πλάναι;"
Aeschylus,Prometheus Bound,577,ὦ,4,"τί ποτέ μʼ, ὦ Κρόνιε παῖ, τί ποτε ταῖσδʼ ἐνέζευξας εὑρὼν ἁμαρτοῦσαν ἐν πημοναῖσιν;"
Aeschylus,Prometheus Bound,593,ὦ,4,"τίς ἄρα μʼ, ὦ τάλας, τὰν τάλαιναν ὧδʼ ἔτυμα προσθροεῖς;"
Aeschylus,Prometheus Bound,593,ἰώ,10,"θεόσυτόν τε νόσον ὠνόμασας, ἃ μαραίνει με χρίουσα κέντροις, ἰώ φοιταλέοισιν ἓ ἕ·"
Aeschylus,Prometheus Bound,613,ὦ,1,"ὦ κοινὸν ὠφέλημα θνητοῖσιν φανείς, τλῆμον Προμηθεῦ, τοῦ δίκην πάσχεις τάδε;"
Aeschylus,Prometheus Bound,645,ὦ,13,"αἰεὶ γὰρ ὄψεις ἔννυχοι πωλεύμεναι ἐς παρθενῶνας τοὺς ἐμοὺς παρηγόρουν λείοισι μύθοις ὦ μέγʼ εὔδαιμον κόρη, τί παρθενεύει δαρόν, ἐξόν σοι γάμου τυχεῖν μεγίστου;"
Aeschylus,Prometheus Bound,651,ὦ,3,"σὺ δʼ, ὦ παῖ, μὴʼπολακτίσῃς λέχος τὸ Ζηνός, ἀλλʼ ἔξελθε πρὸς Λέρνης βαθὺν λειμῶνα, ποίμνας βουστάσεις τε πρὸς πατρός, ὡς ἂν τὸ Δῖον ὄμμα λωφήσῃ πόθου."
Aeschylus,Prometheus Bound,687,ἔα,1,"ἔα ἔα, ἄπεχε, φεῦ·"
Aeschylus,Prometheus Bound,687,ἔα,2,"ἔα ἔα, ἄπεχε, φεῦ·"
Aeschylus,Prometheus Bound,687,φεῦ,4,"ἔα ἔα, ἄπεχε, φεῦ·"
Aeschylus,Prometheus Bound,694,ἰὼ,1,"ἰὼ μοῖρα μοῖρα, πέφρικʼ εἰσιδοῦσα πρᾶξιν Ἰοῦς."
Aeschylus,Prometheus Bound,739,ὦ,4,"πικροῦ δʼ ἔκυρσας, ὦ κόρη, τῶν σῶν γάμων μνηστῆρος."
Aeschylus,Prometheus Bound,742,ἰώ,1,"ἰώ μοί μοι, ἒ ἔ."
Aeschylus,Prometheus Bound,742,ἒ,4,"ἰώ μοί μοι, ἒ ἔ."
Aeschylus,Prometheus Bound,742,ἔ,5,"ἰώ μοί μοι, ἒ ἔ."
Aeschylus,Prometheus Bound,743,αὖ,3,σὺ δʼ αὖ κέκραγας κἀναμυχθίζῃ;
Aeschylus,Prometheus Bound,821,αὖ,6,"εἰ δὲ πάντʼ εἴρηκας, ἡμῖν αὖ χάριν δὸς ἥνπερ αἰτούμεσθα, μέμνησαι δέ που."
Aeschylus,Prometheus Bound,877,ἐλελεῦ,1,"ἐλελεῦ ἐλελεῦ, ὑπό μʼ αὖ σφάκελος καὶ φρενοπληγεῖς μανίαι θάλπουσʼ, οἴστρου δʼ ἄρδις χρίει μʼ ἄπυρος·"
Aeschylus,Prometheus Bound,877,ἐλελεῦ,2,"ἐλελεῦ ἐλελεῦ, ὑπό μʼ αὖ σφάκελος καὶ φρενοπληγεῖς μανίαι θάλπουσʼ, οἴστρου δʼ ἄρδις χρίει μʼ ἄπυρος·"
Aeschylus,Prometheus Bound,877,αὖ,5,"ἐλελεῦ ἐλελεῦ, ὑπό μʼ αὖ σφάκελος καὶ φρενοπληγεῖς μανίαι θάλπουσʼ, οἴστρου δʼ ἄρδις χρίει μʼ ἄπυρος·"
Aeschylus,Prometheus Bound,894,ὦ,4,"μήποτε μήποτέ μʼ, ὦ πότνιαι Μοῖραι, λεχέων Διὸς εὐνάτειραν ἴδοισθε πέλουσαν·"
Aeschylus,Prometheus Bound,980,ὤμοι,1,ὤμοι.
Aeschylus,Prometheus Bound,980,ὤμοι,1,ὤμοι;
Aeschylus,Prometheus Bound,999,ὦ,2,"τόλμησον, ὦ μάταιε, τόλμησόν ποτε πρὸς τὰς παρούσας πημονὰς ὀρθῶς φρονεῖν, ὀχλεῖς μάτην με κῦμʼ ὅπως παρηγορῶν."
Aeschylus,Prometheus Bound,1089,ὦ,1,"ὦ μητρὸς ἐμῆς σέβας, ὦ πάντων αἰθὴρ κοινὸν φάος εἱλίσσων, ἐσορᾷς μʼ ὡς ἔκδικα πάσχω."
Aeschylus,Prometheus Bound,1089,ὦ,5,"ὦ μητρὸς ἐμῆς σέβας, ὦ πάντων αἰθὴρ κοινὸν φάος εἱλίσσων, ἐσορᾷς μʼ ὡς ἔκδικα πάσχω."
Aristophanes,Plutus,1,ὦ,5,ὡς ἀργαλέον πρᾶγμʼ ἐστὶν ὦ Ζεῦ καὶ θεοὶ δοῦλον γενέσθαι παραφρονοῦντος δεσπότου.
Aristophanes,Plutus,15,γρῦ,18,"οἱ γὰρ βλέποντες τοῖς τυφλοῖς ἡγούμεθα, οὗτος δʼ ἀκολουθεῖ, κἀμὲ προσβιάζεται, καὶ ταῦτʼ ἀποκρινομένῳ τὸ παράπαν οὐδὲ γρῦ."
Aristophanes,Plutus,18,ὦ,16,"ἐγὼ μὲν οὖν οὐκ ἔσθʼ ὅπως σιγήσομαι, ἢν μὴ φράσῃς ὅ τι τῷδʼ ἀκολουθοῦμέν ποτε ὦ δέσποτʼ, ἀλλά σοι παρέξω πράγματα."
Aristophanes,Plutus,45,ὦ,9,εἶτʼ οὐ ξυνίης τὴν ἐπίνοιαν τοῦ θεοῦ φράζουσαν ὦ σκαιότατέ σοι σαφέστατα ἀσκεῖν τὸν υἱὸν τὸν ἐπιχώριον τρόπον;
Aristophanes,Plutus,66,ὦ,1,ὦ τᾶν _ ἀπαλλάχθητον ἀπʼ ἐμοῦ.
Aristophanes,Plutus,67,ὦ,7,καὶ μὴν ὃ λέγω βέλτιστόν ἐστʼ ὦ δέσποτα.
Aristophanes,Plutus,78,ὦ,1,"ὦ μιαρώτατε ἀνδρῶν ἁπάντων, εἶτʼ ἐσίγας Πλοῦτος ὤν;"
Aristophanes,Plutus,81,ὦ,1,"ὦ Φοῖβʼ Ἄπολλον καὶ θεοὶ καὶ δαίμονες καὶ Ζεῦ, τί φῄς;"
Aristophanes,Plutus,123,ὦ,2,ἄληθες ὦ δειλότατε πάντων δαιμόνων;
Aristophanes,Plutus,127,ἆ,1,ἆ μὴ λέγʼ ὦ πόνηρε ταῦτʼ.
Aristophanes,Plutus,127,ὦ,4,ἆ μὴ λέγʼ ὦ πόνηρε ταῦτʼ.
Aristophanes,Plutus,169,οἴμοι,1,οἴμοι τάλας ταυτί μʼ ἐλάνθανεν πάλαι.
Aristophanes,Plutus,220,παπαῖ,1,παπαῖ πονηρούς γʼ εἶπας ἡμῖν συμμάχους.
Aristophanes,Plutus,230,ὦ,3,σὺ δʼ ὦ κράτιστε Πλοῦτε πάντων δαιμόνων εἴσω μετʼ ἐμοῦ δεῦρʼ εἴσιθʼ·
Aristophanes,Plutus,253,ὦ,1,"ὦ πολλὰ δὴ τῷ δεσπότῃ ταὐτὸν θύμον φαγόντες, ἄνδρες φίλοι καὶ δημόται καὶ τοῦ πονεῖν ἐρασταί, ἴτʼ ἐγκονεῖτε σπεύδεθʼ, ὡς ὁ καιρὸς οὐχὶ μέλλειν, ἀλλʼ ἔστʼ ἐπʼ αὐτῆς τῆς ἀκμῆς, ᾗ δεῖ παρόντʼ ἀμύνειν."
Aristophanes,Plutus,265,ὦ,6,ἔχων ἀφῖκται δεῦρο πρεσβύτην τινʼ ὦ πόνηροι ῥυπῶντα κυφὸν ἄθλιον ῥυσὸν μαδῶντα νωδόν·
Aristophanes,Plutus,268,ὦ,1,ὦ χρυσὸν ἀγγείλας ἐπῶν πῶς φῄς;
Aristophanes,Plutus,275,ἰοὺ,6,"αἱ κνῆμαι δέ σου βοῶσιν ἰοὺ ἰού, τὰς χοίνικας καὶ τὰς πέδας ποθοῦσαι."
Aristophanes,Plutus,275,ἰού,7,"αἱ κνῆμαι δέ σου βοῶσιν ἰοὺ ἰού, τὰς χοίνικας καὶ τὰς πέδας ποθοῦσαι."
Aristophanes,Plutus,290,θρεττανελὸ,5,καὶ μὴν ἐγὼ βουλήσομαι θρεττανελὸ τὸν Κύκλωπα μιμούμενος καὶ τοῖν ποδοῖν ὡδὶ παρενσαλεύων ὑμᾶς ἄγειν.
Aristophanes,Plutus,292,εἶα,2,ἀλλʼ εἶα τέκεα θαμίνʼ ἐπαναβοῶντες βληχώμενοί τε προβατίων αἰγῶν τε κιναβρώντων μέλη ἕπεσθʼ ἀπεψωλημένοι·
Aristophanes,Plutus,296,αὖ,4,"ἡμεῖς δέ γʼ αὖ ζητήσομεν θρεττανελὸ τὸν Κύκλωπα βληχώμενοι, σὲ τουτονὶ πεινῶντα καταλαβόντες, πήραν ἔχοντα λάχανά τʼ ἄγρια δροσερά, κραιπαλῶντα ἡγούμενον τοῖς προβατίοις, εἰκῇ δὲ καταδαρθόντα που μέγαν λαβόντες ἡμμένον σφηκίσκον ἐκτυφλῶσαι."
Aristophanes,Plutus,296,θρεττανελὸ,6,"ἡμεῖς δέ γʼ αὖ ζητήσομεν θρεττανελὸ τὸν Κύκλωπα βληχώμενοι, σὲ τουτονὶ πεινῶντα καταλαβόντες, πήραν ἔχοντα λάχανά τʼ ἄγρια δροσερά, κραιπαλῶντα ἡγούμενον τοῖς προβατίοις, εἰκῇ δὲ καταδαρθόντα που μέγαν λαβόντες ἡμμένον σφηκίσκον ἐκτυφλῶσαι."
Aristophanes,Plutus,316,εἶα,2,"ἀλλʼ εἶα νῦν τῶν σκωμμάτων ἀπαλλαγέντες ἤδη ὑμεῖς ἐπʼ ἄλλʼ εἶδος τρέπεσθʼ, ἐγὼ δʼ ἰὼν ἤδη λάθρᾳ βουλήσομαι τοῦ δεσπότου λαβών τινʼ ἄρτον καὶ κρέας μασώμενος τὸ λοιπὸν οὕτω τῷ κόπῳ ξυνεῖναι."
Aristophanes,Plutus,343,ὦ,4,"νὴ τοὺς θεοὺς ὦ Βλεψίδημʼ ἄμεινον ἢ χθὲς πράττομεν, ὥστε μετέχειν ἔξεστιν·"
Aristophanes,Plutus,353,αὖ,10,τό τε γὰρ ἐξαίφνης ἄγαν οὕτως ὑπερπλουτεῖν τό τʼ αὖ δεδοικέναι πρὸς ἀνδρὸς οὐδὲν ὑγιές ἐστʼ εἰργασμένου.
Aristophanes,Plutus,362,φεῦ,1,"φεῦ, ὡς οὐδὲν ἀτεχνῶς ὑγιές ἐστιν οὐδενός, ἀλλʼ εἰσὶ τοῦ κέρδους ἅπαντες ἥττονες."
Aristophanes,Plutus,374,ὦ,1,"ὦ Ἡράκλεις, φέρε ποῖ τις ἂν τράποιτο;"
Aristophanes,Plutus,377,ὦ,1,"ὦ τᾶν ἐγώ τοι τοῦτʼ ἀπὸ σμικροῦ πάνυ ἐθέλω διαπρᾶξαι πρὶν πυθέσθαι τὴν πόλιν, τὸ στόμʼ ἐπιβύσας κέρμασιν τῶν ῥητόρων."
Aristophanes,Plutus,386,ὦ,2,"οὒκ ὦ κακόδαιμον, ἀλλὰ τοὺς χρηστοὺς μόνους ἔγωγε καὶ τοὺς δεξιοὺς καὶ σώφρονας ἀπαρτὶ πλουτῆσαι ποιήσω."
Aristophanes,Plutus,389,οἴμοι,1,"οἴμοι τῶν κακῶν, ἀπολεῖς."
Aristophanes,Plutus,391,ὦ,6,"ου ̓ δῆτʼ, ἐπεὶ τὸν Πλοῦτον ὦ μόχθηρε σὺ ἔχω."
Aristophanes,Plutus,415,ὦ,1,ὦ θερμὸν ἔργον κἀνόσιον καὶ παράνομον τολμῶντε δρᾶν ἀνθρωπαρίω κακοδαίμονε _ ποῖ ποῖ;
Aristophanes,Plutus,439,ὦ,1,ὦ δειλότατον σὺ θηρίον·
Aristophanes,Plutus,442,ὦ,4,"Πενία γάρ ἐστιν ὦ πόνηρʼ, ἧς οὐδαμοῦ οὐδὲν πέφυκε ζῷον ἐξωλέστερον."
Aristophanes,Plutus,454,ὦ,5,"γρύζειν δὲ καὶ τολμᾶτον ὦ καθάρματε, ἐπʼ αὐτοφώρῳ δεινὰ δρῶντʼ εἰλημμένω;"
Aristophanes,Plutus,456,ὦ,3,σὺ δʼ ὦ κάκιστʼ ἀπολουμένη τί λοιδορεῖ ἡμῖν προσελθοῦσʼ οὐδʼ ὁτιοῦν ἀδικουμένη;
Aristophanes,Plutus,458,ὦ,3,οὐδὲν γὰρ ὦ πρὸς τῶν θεῶν νομίζετε ἀδικεῖν με τὸν Πλοῦτον ποιεῖν πειρωμένω βλέψαι πάλιν;
Aristophanes,Plutus,472,ὦ,4,ταυτὶ σὺ τολμᾷς ὦ μιαρωτάτη λέγειν;
Aristophanes,Plutus,476,ὦ,1,ὦ τύμπανα καὶ κύφωνες οὐκ ἀρήξετε;
Aristophanes,Plutus,478,ἰοὺ,7,καὶ τίς δύναιτʼ ἂν μὴ βοᾶν ἰοὺ ἰοὺ τοιαῦτʼ ἀκούων;
